Article,Date
Praperadilan Penyelewengan Dana Reses PAN Tak Diterima,2023-05-15 17:41:00
Muhaimin Iskandar Bertemu Wapres Ma'ruf di Rumah Dinas Wapres,2023-05-15 17:33:00
"Jokowi Terima Banyak Aduan soal Jalan Rusak, Istana Pastikan Segera Diperbaiki",2023-05-15 17:27:00
KPK Panggil Sekretaris MA dan Dadan Tri Yudianto sebagai Tersangka Rabu Pekan Ini,2023-05-15 17:03:00
"Prabowo: Rukun Itu Gampang Diucapkan, Sulit Dilaksanakan",2023-05-15 17:03:00
Golkar Dorong Duet Prabowo-Airlangga Sesuai Keinginan Relawan Jokowi,2023-05-15 16:51:00
Jaksa Agung Tak Tutup Kemungkinan Jerat Menkominfo di Kasus Korupsi BTS 4G jika...,2023-05-15 16:46:00
"Praktisi Kesehatan Ramai-ramai Tolak RUU Kesehatan, Kemenkes: Penolakan Hambat Kebutuhan Perlindungan Hukum yang Jelas",2023-05-15 16:43:00
"Reformasi Berjalan 25 Tahun, Mahasiswa Perlu Terus Suarakan Ketidakadilan",2023-05-15 16:42:00
"Maju Jadi Caleg 2024, Menaker Ida: Kalau Harus Kampanye dan Cuti, Kita Cuti",2023-05-15 16:30:00
"Ganjar Jadi Kandidat Kuat Capres, PDI-P Apresiasi Relawan Jokowi",2023-05-15 16:18:00
"Pendaftaran Bacaleg Berakhir, KPU Umumkan Daftar Caleg Sementara pada 19 Agustus",2023-05-15 16:01:00
"25 Tahun Reformasi, Ketimpangan Masih Jadi Isu Terkini",2023-05-15 16:00:00
"Kapal Perang Australia HMAS Launceston III Tiba di Indonesia, Bakal Gelar Latihan dengan TNI AL di NTT",2023-05-15 15:57:00
"Video Viral Napi Hidup Mewah di Lapas, Wamenkumham: Kakanwil Akan Bentuk Tim Pemeriksaan",2023-05-15 15:57:00
"Keponakannya Ditahan Polisi, Wamenkumham: Itu Hal Pribadi, Bukan Terkait Tugas",2023-05-15 15:54:00
"Soal Rencana Temui SBY, Prabowo: Pertemuan Sesama Purnawirawan, Biasa Itu...",2023-05-15 15:46:00
Perindo Umumkan Capres yang Didukung Paling Lambat Juni 2023,2023-05-15 15:45:00
"367 DIM RUU PPRT Sudah Final, Pemerintah Bakal Serahkan ke DPR dalam Waktu Dekat",2023-05-15 15:35:00
"Sensus Pertanian 2023, Jokowi: Saya Minta Seluruh Pemangku Kepentingan Mendukung",2023-05-15 15:19:00
"Kejagung Usut 2 Kasus Dugaan Korupsi Komoditas Emas, Salah Satunya di Antam",2023-05-15 15:08:00
5 Tersangka Kasus Korupsi BTS 4G Kominfo Segera Disidang,2023-05-15 15:04:00
KPK Tetapkan Kepala Bea Cukai Makassar Andhi Pramono Tersangka,2023-05-15 14:48:00
Han dan Kisah-kisah Pilu Saksi Kerusuhan Jakarta Mei 1998: Saat Penjarahan hingga Pembakaran Melanda,2023-05-15 14:44:00
DPR Minta Pemerintah Tingkatkan Peremajaan Alutsista Indobatt di Lebanon,2023-05-15 14:43:00
TNI AD dan US Army Lanjutkan Kerja Sama Militer,2023-05-15 14:39:00
Istana Jelaskan Alasan Jokowi Buka Aduan Jalan Rusak di Instagram,2023-05-15 14:29:00
"KPK Cegah Kepala Bea Cukai Makassar Andhi Pramono yang Disorot karena ""Flexing""",2023-05-15 14:20:00
Golkar Anggap Hasil Musra Tunjukkan Prabowo dan Airlangga Cocok Jadi Pasangan Capres-Cawapres,2023-05-15 14:18:00
Sidang Prapedilan Dugaan Gratifikasi Firli Bahuri Kembali Ditunda,2023-05-15 14:11:00
"Usai Dicegah, Adik Rafael Alun Kini Diperiksa KPK sebagai Saksi",2023-05-15 13:59:00
Menteri Investasi Sebut Investasi Masuk ke IKN Setelah Infrastruktur Dasar Rampung,2023-05-15 13:57:00
"Sebulan 2 Kali Bertemu Presiden, Hary Tanoe Bantah Bahas Isu ""Reshuffle"" dan Pilpres 2024",2023-05-15 13:54:00
"Minta Nasihat soal Pilpres 2024, Cak Imin Temui Ma'ruf Amin di Istana Sore Ini",2023-05-15 13:50:00
"Bertemu Delegasi Korsel, Jokowi Minta Kerja Sama Ekonomi dan Investasi Ditingkatkan",2023-05-15 13:43:00
Dugaan Kerugian Negara dalam Kasus BTS 4G Bakti Kominfo Capai Rp 8 T,2023-05-15 13:42:00
"Menghentikan Proyek ""Food Estate"" Indonesia",2023-05-15 13:29:00
"Belum Tentukan Pilihan Parpol, Sandiaga Uno Ingin Kembali Bertemu Mardiono",2023-05-15 13:14:00
Andi Arief Mengaku Dicecar Penyidik KPK Soal Sumbangan Bupati Mamberamo Tengah,2023-05-15 13:03:00
"Anies Kritik Subsidi Mobil Listrik, Moeldoko: Jalan Saja, Kan Program Pemerintah",2023-05-15 12:59:00
"Didampingi Iwan Bule, Prabowo Datangi Kantor Persatuan Purnawirawan Polri",2023-05-15 12:57:00
"Hadiri Forum Bisnis Indonesia–Mesir, Mendag Akan Perkuat Hubungan Dagang Kedua Negara",2023-05-15 12:48:00
"Data Pertanian Tidak Akurat, Jokowi Akui Pemerintah Kedodoran",2023-05-15 12:42:00
Pelunasan Biaya Haji 2023 Kembali Diperpanjang hingga 19 Mei 2023,2023-05-15 12:41:00
"Jadwal Lengkap Pencalonan DPR dan DPRD Pemilu 2024, Berlangsung hingga November 2023",2023-05-15 12:40:00
Ombudsman Panggil Firli Bahuri Terkait Pemberhentian Brigjen Endar Pekan Ini,2023-05-15 12:32:00
"Namanya Masuk Bursa Capres Versi Musra, Airlangga: Terima Kasih",2023-05-15 12:29:00
KPK Periksa Andi Arief Sebagai Saksi Dugaan Korupsi dan TPPU Bupati Mamberamo Tengah,2023-05-15 12:24:00
"Luncurkan Sensus Pertanian 2023, Jokowi: Terakhir 10 Tahun Lalu",2023-05-15 11:51:00
"Lagi, Hary Tanoe ""Menghadap"" Jokowi di Istana",2023-05-15 11:48:00
"Prabowo Datangi Keluarga Besar Pensiunan Polri Siang Ini, Ada Apa?",2023-05-15 11:43:00
"Sepakat Damai, Keluarga Aisiah Cabut Laporan Pengelola Bandara Kualanamu dkk di Bareskrim",2023-05-15 11:38:00
"Peras Tersangka hingga Puluhan Juta Rupiah, Oknum Jaksa di Sumut Dinonaktifkan",2023-05-15 11:36:00
KPK Cegah 8 Pegawai BPK Riau Terkait Korupsi Bupati Kepulauan Meranti,2023-05-15 11:27:00
Jokowi dan Dukungan Politik Capres 2024,2023-05-15 11:25:00
Fenomena Kader Pindah Saat Pemilu: Caleg dan Parpol Saling Incar Keuntungan,2023-05-15 11:21:00
"Namanya Masuk Bursa Cawapres Musra, Moeldoko: Kalau Diberi Kesempatan, Kita Gas Saja",2023-05-15 11:20:00
Pertagas Fokus Perbaiki Fasilitas Umum yang Terdampak Proyek Pipa Gas Senipah–Balikpapan,2023-05-15 11:18:00
Reformasi '98 dan Beragam Agenda yang Belum Tercapai,2023-05-15 10:42:00
"KPU Verifikasi Bakal Caleg Pemilu 2024 sampai 23 Juni 2023, Ini Tahapannya",2023-05-15 10:08:00
"Berdayakan Petani Lokal, Dompet Dhuafa Luncurkan Green House Lido yang Mampu Tampung 1.600 Tanaman",2023-05-15 09:33:00
"Ganjar dan Prabowo, antara ""Gaspool""  dan ""Tiji Tibeh""",2023-05-15 09:26:00
"Hari Ini, PN Jaksel Gelar Putusan Praperadilan Penyelewengan Dana Reses PAN",2023-05-15 09:24:00
"BPOM Rilis 176 Obat Aman Penuhi Ketentuan, Totalnya Jadi 941 Produk",2023-05-15 08:49:00
"Musra dan Manuver Jokowi sebagai ""King Maker"" Terkuat",2023-05-15 08:04:00
"Sepekan Pendaftaran Bacaleg: Partai ""Deadliner"", Jalanan Macet, dan Artis yang Jadi Andalan ""Vote Getter""",2023-05-15 07:40:00
"Belum Terima Surat Pengunduran Diri, Dedi Mulyadi Masih Didaftarkan Golkar sebagai Bacaleg",2023-05-15 06:30:00
"Minta Menteri dan Anggota DPR yang Jadi Caleg ""Resign"", AHY: ""Fair, Gentlement""",2023-05-15 05:56:00
Pilpres dan Kepentingan Ekonomi Politik Pemilih Muda,2023-05-15 05:45:00
Golkar Makin Percaya Diri Usai Nama Airlangga Muncul sebagai Kandidat Capres Versi Musra,2023-05-15 05:38:00
"Puji Timnas U-22 di SEA Games, Presiden Jokowi: Mental Pemenang!",2023-05-15 05:30:00
"Pendaftaran Selesai, KPU Verifikasi Administrasi Berkas Bacaleg hingga 23 Juni",2023-05-15 05:08:00
"Partai Buruh Jadi Parpol Terakhir Daftar Bacaleg ke KPU, Sempat Bawa ""Printer""",2023-05-15 05:04:00
Partai Buruh Tak Libatkan Artis dan Pengusaha di Daftar Bacaleg,2023-05-15 05:04:00
[POPULER NASIONAL] Jokowi Ingatkan Rakyat Jangan Keliru Pilih Pemimpin | Menteri Jokowi Jadi Caleg,2023-05-15 05:00:00
Tanggal 17 Mei Hari Memperingati Apa?,2023-05-15 00:00:00
Begini Respons Jokowi Tanggapi Kritik Anies Baswedan soal Mobil Listrik,2023-05-14 22:12:00
Tiga Menteri Golkar di Kabinet Jokowi Tak Maju sebagai Bacaleg DPR RI pada Pemilu 2024,2023-05-14 22:07:00
PKN Daftarkan 580 Bacaleg ke KPU RI,2023-05-14 21:00:00
PPP Tidak Masalah jika Golkar dan PAN Tak Dukung Ganjar Jadi Capres,2023-05-14 20:23:00
Fahri Hamzah Daftar Caleg DPR dari Partai Gelora,2023-05-14 20:13:00
Partai Gelora Daftarkan 481 Bacaleg ke KPU,2023-05-14 19:44:00
"Hadiri Puncak Musra, Arsul Sani: PPP Sambut Positif Hasil Capres-Cawapres yang Diusulkan",2023-05-14 19:35:00
"Soal Jokowi Bakal Bisiki Parpol Terkait Capres, AHY: Silakan, tapi Kawal Demokrasi Jadi Ruang bagi Semua",2023-05-14 19:21:00
Kehadiran Ganjar Pranowo Disambut Meriah Ribuan Warga Bandung,2023-05-14 18:42:00
Jokowi: Pemimpin Selanjutnya Jangan Takut Digugat Negara Mana Pun,2023-05-14 18:40:00
Perindo Daftarkan Jurnalis MNC Group Aiman Witjaksono dan Prabu Revolusi Jadi Caleg 2024,2023-05-14 18:16:00
"Jokowi: Bertahun-tahun Kita Ekspor Bahan Mentah, Pemimpin Selanjutnya Harus Berani Mengindustrikan",2023-05-14 18:08:00
"Musra Serahkan Usulan Capres-Cawapres ke Jokowi, Andi Gani: Kami Tunggu Arahan Bapak",2023-05-14 17:50:00
"AHY Tak Daftar Pileg 2024, Sedangkan Ibas Maju Lagi di Dapil Jatim 7",2023-05-14 17:37:00
"Perindo Bakal ""All Out"" pada Pemilu 2024, Hary Tanoe, Aiman Witjaksono hingga Chef Arnold Daftar Caleg",2023-05-14 17:25:00
"Jokowi: Rakyat Butuh Pemimpin yang Tepat, Bukan Hanya Duduk di Istana",2023-05-14 17:19:00
"Demokrat Terbuka dengan Rencana Pertemuan Prabowo-SBY, tapi..",2023-05-14 17:15:00
AHY Ingin Demokrat Dapat 85 Kursi DPR RI di Pileg 2024,2023-05-14 16:46:00
"Simpan Nama Capres-Cawapres Hasil Musra, Jokowi: Bagian Saya Beri Bisikan Kuat ke Partai",2023-05-14 16:39:00
"Ingatkan Ketidakpastian Dunia, Jokowi: Nakhodanya Harus Berani",2023-05-14 16:32:00
"Geopolitik Pengaruhi Komoditas Energi, Optimalisasi Gas di Masa Transisi Jadi Kunci",2023-05-14 16:08:00
"Kepada Relawan, Jokowi: Pilih Pemimpin Tahun 2024 Ini Sangat Penting, Jangan Grasa-grusu",2023-05-14 16:05:00
"Jokowi: Indonesia Berpeluang Jadi Negara Maju 13 Tahun Lagi, Jangan Keliru Pilih Pemimpin",2023-05-14 16:00:00
"Soal Menteri Jadi Peserta Pemilu 2024, Jokowi: Kalau Kerjanya Terganggu Bisa Diganti",2023-05-14 15:46:00
Jokowi: Siapa Sih Capres yang Diinginkan Rakyat? Jangan sampai Keliru,2023-05-14 15:20:00
"Jokowi: Kita Ingin Merawat Demokrasi di Akar Rumput, Bukan di Elite",2023-05-14 14:49:00
"Daftarkan Bacaleg Demokrat ke KPU, AHY dan Ibas Nyanyikan Lagu Koyo Jogja Istimewa",2023-05-14 14:48:00
Nama Capres-Cawapres Hasil Musra Diserahkan ke Jokowi,2023-05-14 14:12:00
"Eva Sundari, Surya Tjandra dan Daeng M Faqih Disebut Jadi Bacaleg Nasdem",2023-05-14 13:58:00
"Hadiri Puncak Acara Musra, Jokowi Sapa Relawan hingga ke Tribun",2023-05-14 13:47:00
Nasdem Klaim Eva Sundari Gabung Nasdem karena Tertarik Isu yang Diperjuangkan di DPR,2023-05-14 13:43:00
"Daftar Cawapres Usulan Musra: Mahfud MD, Sandiaga Uno hingga Ridwan Kamil",2023-05-14 12:49:00
"Diiringi Rampak Gendang, AHY Bakal Daftarkan Bacaleg Demokrat ke KPU Siang Ini",2023-05-14 12:24:00
Badai Eks Kerispatih dan Komika Mongol Bakal Ikut Berebut Kursi DPR RI dari PSI,2023-05-14 12:14:00
"Mutasi TNI, Panglima Yudo Tunjuk Mayjen Muhammad Nur Rahmad Jadi Asistennya",2023-05-14 12:08:00
Jokowi Akan Tentukan 1 dari 3 Nama Usulan Capres Hasil Musra,2023-05-14 11:59:00
"Daftarkan Bacaleg ke KPU, PSI Kejar Target 15 Juta Suara pada Pemilu 2024",2023-05-14 11:01:00
"Jelang Puncak Musra, Relawan Jokowi Padati Istora Senayan",2023-05-14 10:53:00
Raja Juli Antoni Tak Diajukan sebagai Caleg PSI pada Pemilu 2024,2023-05-14 10:47:00
"Daftarkan Bakal Calegnya ke KPU, PSI: Kami Tak Calonkan Mantan Koruptor",2023-05-14 10:41:00
"Fadel Muhammad Menang di PTUN, Pemecatannya dari MPR Dibatalkan",2023-05-14 09:49:00
"Pilot Susi Air Belum Juga Dibebaskan, Kini KKB Sandera 4 Pekerja BTS",2023-05-14 09:39:00
"Sejumlah Menteri Jokowi Ramaikan Bursa Pileg 2024, Berikut Daftarnya...",2023-05-14 09:21:00
"Bawa Spanduk Jokowi, Giring Daftarkan Bacaleg PSI ke KPU",2023-05-14 08:52:00
Tujuh Parpol Daftarkan Bakal Caleg ke KPU Hari Ini,2023-05-14 08:32:00
"Panglima TNI Mutasi 18 Perwira Tinggi, Mayjen Nur Alamsyah Jadi Komandan Korps Marinir",2023-05-14 08:24:00
"Puncak Musra Digelar Hari Ini, Jokowi Bakal Beri Arahan ke Relawan soal Pilpres",2023-05-14 07:04:00
“Presiden Apa Anda? Anda Naif”,2023-05-14 06:36:00
"Ganjar Minta Pendukungnya Tak Sebar Hoaks dan ""Bully"" Orang Lain",2023-05-14 05:20:00
"Di Hadapan Relawan Jokowi, Ganjar Sebut Indonesia Pernah Terbelah karena Beda Pilihan",2023-05-14 05:18:00
Tanggal 16 Mei Hari Memperingati Apa?,2023-05-14 00:00:00
"Bertemu Relawan Jokowi, Ganjar: Hari Ini Kita Mulai Langkah Bersama",2023-05-13 22:37:00
Pemerintah Klaim Dukung Keterwakilan Caleg Perempuan 30 Persen,2023-05-13 21:17:00
"Nyaleg DPR RI, Menaker Ida Fauziah Bakal Lapor ke Jokowi",2023-05-13 20:33:00
"Bursa Cawapres Anies Baswedan, Nama Khofifah Menguat di Internal PKS",2023-05-13 20:30:00
AJI dan LBH Pers Serukan Kasus Klaim Hak Cipta Penggunaan Video Lembaga Publik Tak Terulang,2023-05-13 19:50:00
"Waketum Gerindra: Cawapres Prabowo Belum Pasti, Nama Khofifah hingga Gibran Sempat Diusulkan",2023-05-13 18:41:00
"Soal Pertemuan Prabowo-SBY, Gerindra: Sedang Dicocokan Waktunya",2023-05-13 18:40:00
"PKB Daftarkan Tommy Kurniawan, Susno Duadji, hingga Norman Kamaru Jadi Bacaleg ke KPU",2023-05-13 18:11:00
"Golkar Berpeluang Merapat, Gerindra: ""Golden Ticket"" Cawapres Prabowo Ada di Cak Imin",2023-05-13 18:05:00
"Ganjar: Reformasi Belum Tuntas, Tas, Tas",2023-05-13 17:59:00
"Dedi Mulyadi Gabung Gerindra, Ahmad Muzani: Insya Allah Beliau Nyaleg",2023-05-13 17:55:00
PBB Beri Sinyal Akan Berkoalisi dengan Gerindra dan PKB,2023-05-13 17:50:00
Saat Ganjar Kenang Tragedi Trisakti 25 Tahun Lalu...,2023-05-13 17:45:00
"Diusung Gerindra, Ahmad Dhani 'Nyaleg' DPR RI Dapil I Jatim, Melly Goeslaw Dapil I Jabar",2023-05-13 17:13:00
"Cak Imin atau Airlangga, Siapa Dipilih Prabowo Jadi Cawapres 2024?",2023-05-13 16:35:00
Waketum Gerindra Kritik Pamdal KPU: Dikasih Kekuasaan Sedikit Sudah Sangat Otoritatif,2023-05-13 16:34:00
"Daftar Caleg, Sekjen PBB Siap Mundur sebagai Wamenaker Jika Disuruh Jokowi",2023-05-13 16:23:00
"Kompolnas Dukung Program “Polisi RW”, Diharapkan Serius Tampung Keluhan Masyarakat",2023-05-13 16:05:00
"Yusril Ihza Mahendra ""Nyaleg"" lewat Dapil Jakarta Timur, Anaknya Dapil Bangka Belitung",2023-05-13 15:48:00
"Daftarkan Caleg ke KPU Pakai Vespa, Cak Imin: Salam Satu Aspal!",2023-05-13 15:44:00
"Waketum Gerindra Adu Mulut dengan Pamdal KPU, Merasa Dipersulit Masuk",2023-05-13 15:26:00
PBB Daftarkan 580 Bakal Caleg DPR RI ke KPU,2023-05-13 15:16:00
"PDI-P Tetap Jalin Komunikasi dengan PBNU, Hormati Sikap Jaga Jarak dengan Politik",2023-05-13 14:56:00
"Daftar Caleg, Massa Kader Gerindra Pakai Atribut ""Prabowo Presiden 2024""",2023-05-13 14:30:00
KPK Sebut Ada Pihak yang Rintangi Penyidikan Korupsi Ricky Ham Pagawak,2023-05-13 14:11:00
"Mei 1998, Saat Jakarta Dilanda Kerusuhan Mencekam dan Ditinggal Para Penghuninya...",2023-05-13 14:03:00
"Naik Mobil Komando, Yusril Daftarkan Bacaleg PBB ke KPU",2023-05-13 13:42:00
Polemik RUU Kesehatan: Didemo Ribuan Tenaga Kesehatan dan Pembelaan Pemerintah,2023-05-13 13:25:00
KPK Sita Aset Bupati Mamberamo Tengah Lebih dari Rp 30 M,2023-05-13 12:54:00
"Tolak Terlibat pada Pilpres 2024, PBNU: Tak Akan Ada Capres atau Cawapres atas Nama NU",2023-05-13 12:32:00
Saat Dugaan Pencucian Uang Rafael Alun Seret Nama Grace Tahir...,2023-05-13 12:10:00
"Tangis Pilu Karsiyah, Ibunda Hendriawan Korban Tragedi Trisakti 1998: Dia Janji Akan Pulang...",2023-05-13 12:07:00
"Lakukan Kerja Sama di Bidang Hukum, Menkumham Tanda Tangani MoU dengan Rusia",2023-05-13 11:32:00
"Cerita di Balik KTT ASEAN 2023, Sekolah Jadi Tempat Menginap TNI",2023-05-13 11:06:00
"""Ada Darah, Keringat, dan Air Mata yang Tumpah untuk Cita-cita yang Kini Kita Nikmati""",2023-05-13 10:49:00
PBNU Bantah Sedang Seleksi Kader untuk Jadi Cawapres Ganjar,2023-05-13 10:24:00
Polemik Revisi UU TNI: Potensi Inefisiensi Aturan hingga Kekhawatiran Kembalinya Dwifungsi ABRI,2023-05-13 09:43:00
"Cerita SBY Dukung Jokowi, tapi Ditolak Parpol Koalisi pada Pilpres 2019...",2023-05-13 09:21:00
"Menerka Arah Koalisi Golkar Jelang 2024, Akankah 2014 Terulang?",2023-05-13 09:09:00
25 Tahun Reformasi: Kisah Mahasiswa Kedokteran UKI Ubah Identitas Pasien untuk Kelabui Intel,2023-05-13 07:47:00
"Komnas HAM Janji Selesaikan Penyelidikan Kasus Munir Akhir Tahun Ini, Suciwati: Ini Langkah Maju",2023-05-13 07:26:00
[POPULER NASIONAL] Usulan Jabatan Wakil Panglima TNI Dinilai Inefisien | Menhan Kongo Minta RI Latih Prajurit Khususnya,2023-05-13 05:30:00
"Survei SMRC: Dukungan untuk Ganjar Menguat, Anies Menurun",2023-05-13 05:03:00
"Wamenkumham Sebut KUHP Jadi Salah Satu Solusi Atasi ""Over"" Kapasitas di Lapas",2023-05-13 04:38:00
PPP Ajak Ganjar Bicara dengan Taj Yasin soal Pengunduran Diri sebagai Wagub,2023-05-13 00:11:00
"Kasus Pemalsuan Dokumen dan TPPU Indosurya, Bareksrim Limpahkan Henry Surya ke Kejaksaan",2023-05-13 00:02:00
Tanggal 15 Mei Hari Memperingati Apa?,2023-05-13 00:00:00
Pemerintah Diminta Percepat Pembahasan DIM RUU PPRT,2023-05-12 23:53:00
Wacana Revisi UU TNI Diharap Tak Picu Kembalinya Dwifungsi Militer,2023-05-12 23:40:00
PPP Sambut Baik jika PAN Akhirnya Dukung Ganjar Capres,2023-05-12 23:37:00
Kursi di DPR Dinilai Bisa Jadi Senjata Golkar Lobi Prabowo supaya PKB Melunak,2023-05-12 23:13:00
PKB Dinilai Bisa Minta Jatah Kabinet jika Golkar Ngotot Jadi Cawapres Prabowo,2023-05-12 23:04:00
Kalla: Lebih dari 50 Persen Ekonomi di Indonesia Dikuasai oleh Orang China,2023-05-12 22:57:00
Saat Golkar di Simpang Jalan Mencari Kawan Koalisi Menuju 2024...,2023-05-12 22:54:00
"Terima Kunjungan KSAD AS, Prabowo Tegaskan Indonesia sebagai Pendamai di Indo-Pasifik",2023-05-12 22:44:00
"Bakal ""Sowan"" ke SBY, Prabowo: Insya Allah, Kita Harus Komunikasi dengan Semua Pihak",2023-05-12 22:30:00
"Pertanyakan Keseriusan Sandiaga Uno, PPP: Kirim Kode Warna Lain",2023-05-12 21:49:00
PDI-P: NU Sumber Kawah Candradimuka Calon Pemimpin Bangsa,2023-05-12 21:45:00
"Ribut-ribut Dokter Bisa Digugat di RUU Kesehatan, Kemenkes: Kenapa Tak Dari Dulu Bergerak?",2023-05-12 21:37:00
Komnas HAM Selesaikan Penyelidikan Kasus Pembunuhan Munir Akhir Tahun Ini,2023-05-12 21:37:00
"KPU: Partai Gelora, PBB, PKB, dan Gerindra Daftarkan Bacaleg Sabtu",2023-05-12 21:30:00
"Organisasi Relawan Jokowi ""Projo"" Bakal Dukung Ganjar? Ini Kata PDI-P",2023-05-12 21:24:00
PPP: Kasus Rommy-Erwin Aksa Masalah Personal,2023-05-12 21:17:00
Komnas HAM Minta Petugas TPS pada Pemilu 2024 Diberi Asuransi Kesehatan,2023-05-12 21:16:00
"PPP: Wamenag Maju Caleg di Pileg 2024, Suharso, Mardiono, dan Rommy Tidak",2023-05-12 21:11:00
"Ibunda AP Hasanuddin Minta Maaf ke Warga Muhammadiyah, Harap Anaknya Dimaafkan",2023-05-12 20:57:00
Jokowi Perpanjang Masa Jabatan Pj Gubernur Banten dan Papua Barat,2023-05-12 20:54:00
Rommy PPP: Ada Kemungkinan Megawati Minta Nama Resmi Bakal Cawapres dari PBNU,2023-05-12 20:22:00
"Korlantas Beberkan Alasan SIM Harus Diperpanjang 5 Tahun Sekali, Beda dengan KTP",2023-05-12 20:16:00
"Penyalahgunaan Senpi di Papua Meningkat, TNI AD Minta Komandan Satuan Tingkatkan Pengawasan",2023-05-12 19:59:00
"Komnas HAM Nilai Praktik Politik Uang Berpotensi Terjadi di Wilayah Industri, Terutama Jawa Timur",2023-05-12 19:50:00
"Dituding Kriminalisasi Keponakan, Kubu Wamenkumham Tegaskan Punya Hak Laporkan Peristiwa Pidana",2023-05-12 19:46:00
Mendagri Lantik Ismail Pakaya Jadi Pj Gubernur Gorontalo,2023-05-12 19:43:00
Komnas Perempuan Dapat Laporan Proses Rekrutmen Anggota Bawaslu Daerah Harus Telanjang,2023-05-12 19:41:00
"WNI Korban TPPO Terkait ""Scamming Online"" di Filipina Bertambah Jadi 242 Orang",2023-05-12 19:38:00
PPP Dengar PAN Segera Ikut Usung Ganjar Capres,2023-05-12 19:35:00
"PKB Resisten dengan Ide Airlangga Cawapres Prabowo, Golkar Minta Kesetaraan di Koalisi Besar",2023-05-12 19:31:00
Wapres Yakin Target Kemiskinan Ekstrem Nol Persen Dapat Tercapai pada 2024,2023-05-12 19:30:00
Komisi IV Minta Pemerintah Batalkan Pasal 154 RUU Kesehatan yang Samakan Tembakau dengan Narkotika,2023-05-12 19:26:00
"Survei SMRC: Elektabilitas Ganjar 24,6 Persen, Prabowo 17,2 Persen, Anies 10,7 Persen",2023-05-12 19:24:00
"Terlibat Cinta Segitiga, Pemuda di Palmerah Tewas Usai Dipukuli Temannya yang Cemburu",2023-05-12 18:55:00
KPK Sita Rumah Rafael yang Dibeli dari Grace Tahir,2023-05-12 18:48:00
Mendagri Lantik Zudan Arief Fakhrulloh Jadi Pj Gubernur Sulawesi Barat,2023-05-12 18:21:00
"Sisa 2 Hari, Sejumlah Partai Politik Belum Daftarkan Caleg ke KPU RI, Ini Daftarnya",2023-05-12 18:21:00
"Kisah Nahas AM, Perempuan Asal Aceh yang Diperkosa di Depan Bayinya Ketika Ikut Suami Merantau ke Jakarta",2023-05-12 18:15:00
"PAN Berubah Pikiran, Tahan Zulhas Turun Gunung Ikut Rebut Kursi DPR RI",2023-05-12 18:09:00
"[UPDATE] Tersisa 3 Hari, Baru 452 Bacalon DPD Daftar ke KPU",2023-05-12 18:05:00
"Diiringi Pawai Budaya, PDI-P Jatim Daftarkan 120 Bacaleg Tingkat Provinsi ke KPU",2023-05-12 17:13:00
Zulhas soal Nasib KIB: 2 Pekan Ini Ada Titik Terang,2023-05-12 17:01:00
"Bareskrim Buru DPO Kurir 264,73 Kg Sabu Cair Jaringan Iran-Indonesia",2023-05-12 16:54:00
"Daftarkan Bacaleg ke KPU, Rombongan PPP Gunakan Sepeda Listrik",2023-05-12 16:53:00
"Jokowi: Kita Sudah Masuk Tahun Politik, Situasi Kondusif Harus Dijaga Betul",2023-05-12 16:53:00
"Selain Kepala Desa, Sederet Pejabat Ini Harus Mundur dari Jabatan jika Jadi Caleg",2023-05-12 16:49:00
Megawati dan Ganjar Bakal Resmikan Kantor Sekretariat Relawan PDI-P pada 1 Juni,2023-05-12 16:44:00
Jaksa KPK Tuntut Pengacara Penyuap Hakim Agung Yosep Parera Dipenjara 9 Tahun 4 Bulan,2023-05-12 16:23:00
"PKB dan Golkar Punya Kepentingan Berbeda, Koalisi Besar Dinilai Sulit Terwujud",2023-05-12 15:50:00
"Zulhas Siapkan ""Karpet Biru"" jika Murad Ismail Mau Masuk PAN",2023-05-12 15:48:00
"Total Pendaftar Relawan Ganjar 1.000 Organisasi, 457 Terverifikasi",2023-05-12 15:40:00
"Besok, Ganjar Pranowo Gelar Halalbihalal dengan Relawan Pendukung Jokowi",2023-05-12 15:39:00
Zulhas Bantah Kabar Akan Jadi Caleg,2023-05-12 15:39:00
Komnas Perempuan Sebut Peraturan KPU soal Caleg Perempuan Merugikan,2023-05-12 15:37:00
"Menpan-RB Resmikan 4 MPP di Sumatera, Gerbang Investasi dan Peningkatan Ekonomi Masyarakat",2023-05-12 15:33:00
Dua Kepala Daerah Gugat Syarat Batas Usia Cawapres ke MK,2023-05-12 15:23:00
Kasus Anggota TNI AD yang Tabrak Pasutri hingga Tewas Telah Dilimpahkan ke Oditurat Militer,2023-05-12 15:18:00
"Diiringi Marching Band, Zulhas dan Ratusan Kader PAN Daftar Caleg ke KPU",2023-05-12 15:13:00
"Minta Ada Hilirisasi Pertanian, Wapres: Bermanfaat ke Rakyat, kalau Hilirisasi Tambang ke Pengusaha",2023-05-12 15:09:00
"Jika Tak Dipilih Jadi Cawapres Prabowo, Cak Imin Diyakini Tinggalkan Koalisi dengan Gerindra",2023-05-12 15:09:00
Massa PAN Sempat Cekcok dengan Pasukan Jagat Saksana KPU Saat Pendaftaran Bacaleg,2023-05-12 15:06:00
"Soroti Polisi RW, Wakil Ketua Komisi III: Inovatif, tapi Harus Jalankan Tugas Sesuai Koridor Hukum",2023-05-12 14:58:00
KPK Sebut Ada Jual Beli Rumah antara Rafael Alun dan Grace Tahir,2023-05-12 14:55:00
"Ungkap Peran Yayasan di Lapas, Wamenkumham: Karya Warga Binaan Dipasarkan ke Luar Negeri",2023-05-12 14:51:00
"SMRC: Elektabilitas Ganjar Turun di Perkotaan, Anies di Desa",2023-05-12 14:46:00
Wapres Sebut Pemerintah Sudah Alokasikan Rp 500 Triliun untuk Dana Desa sejak 2015,2023-05-12 14:21:00
"Ketimbang Airlangga, Prabowo Diprediksi Lebih Pilih Cak Imin Jadi Cawapres",2023-05-12 14:14:00
"Ungkap Kedekatan Sandi dengan PPP, Rommy: Sudah Kenal Beberapa Ketua DPW hingga Para Ulama",2023-05-12 14:11:00
Anggota Komisi I Anggap Tak Tepat Usulan TNI Jadi Alat Keamanan Negara pada Revisi UU TNI,2023-05-12 13:36:00
Wapres Ingatkan Covid-19 Masih Ada meski Status Darurat Sudah Dicabut WHO,2023-05-12 13:00:00
"Keponakan Ditahan, Kuasa Hukum Wamenkumham: Sesuai dengan Prosedur",2023-05-12 12:59:00
Wapres Sebut Indonesia Bersiap Masuk Fase Endemi Setelah Status Darurat Covid-19 Dicabut WHO,2023-05-12 12:53:00
"Wacana Duet Anies-Sandiaga Dinilai Sulit Terwujud, Terganjal Restu Demokrat",2023-05-12 12:51:00
"Antisipasi TPPO, Anggota Komisi I DPR Christina Aryani Dorong Implementasi Tegas UU Perlindungan Pekerja Migran Indonesia",2023-05-12 12:49:00
KPK Cecar Grace Tahir Soal Dugaan Penggunaan Uang Rafael Alun,2023-05-12 12:48:00
ICW Minta Pembahasan RUU Perampasan Aset Terbuka dan Akomodasi Masukan Publik,2023-05-12 12:16:00
KPK Identifikasi 3 Perusahaan Konsultan Pajak Rafael Alun,2023-05-12 12:10:00
Rommy Sebut Erick Thohir dan Sandiaga Uno Diminta Jokowi Dekati Partai Islam,2023-05-12 12:03:00
"Soal Anas Urbaningrum Akan Jadi Ketum PKN, Gede Pasek: Sudah Dibicarakan Berdua",2023-05-12 11:53:00
"Muncul Isu Ahok Diusulkan Luhut Jadi Pendamping Anies, Surya Paloh: Enggak Ada",2023-05-12 11:49:00
KPK Akan Buktikan Kemungkinan Rafael Alun Juga Terima Suap,2023-05-12 11:44:00
"Lepas Prajurit TNI ke Papua, Prabowo: Insya Allah Saya Akan Tengok Kalian di Daerah Operasi",2023-05-12 11:43:00
PKN Tunda Resmikan Anas Urbaningrum sebagai Ketua Umum: Statusnya Masih Cuti Menjelang Bebas,2023-05-12 11:39:00
"700 Anggota Polri Belum Sampaikan LHKPN, KPK: Irwasum Akan Selesaikan Selama Sebulan",2023-05-12 11:36:00
Andika Perkasa Terima Penghargaan Darjah Utama Bakti dari Presiden Singapura atas Jasa Peningkatan Kerja Sama Militer,2023-05-12 11:26:00
"Refleksi 1 Tahun UU TPSK, Masih Banyak Kekerasan Seksual yang Belum Diproses",2023-05-12 11:22:00
"Wapres Dukung Koruptor 'Di-Nusakambangan-kan', jika...",2023-05-12 11:20:00
Wakil Ketua DPR Pastikan Proses RUU Perampasan Aset Sesuai Mekanisme yang Berlaku,2023-05-12 11:20:00
PPP Tak Hanya Pertimbangkan Sandiaga Uno untuk Diusulkan Jadi Cawapres Ganjar,2023-05-12 11:18:00
KPK Sebut Dadan Tri Yudianto Berperan Jadi Calo Kasus di MA,2023-05-12 11:01:00
"[HOAKS] Koalisi Perubahan Bubar, Anies Baswedan Gagal Jadi Capres",2023-05-12 11:01:00
"Satgas TPPU Serahkan 33 Laporan Dugaan Pencucian Uang ke KPK, Nilainya Rp 25,3 Triliun",2023-05-12 10:56:00
Manuver Tajam PKB Usai Dinasihati JK Koalisi Besar Sulit Terwujud,2023-05-12 10:48:00
"Indonesia Dapat Kuota Tambahan Haji, Wapres: Segera Diurus!",2023-05-12 10:43:00
