Article,Date
"Bantah Sugeng IPW, Kuasa Hukum Klaim Wamenkumham Tak Intervensi Perizinan PT CLM",2023-03-28 23:11:00
Pemerintah Usul Ke FIFA Jadwal Ulang Pelaksanaan Piala Dunia U-20 di Indonesia,2023-03-28 22:59:00
"KPK Geledah 4 Tempat Terkait Korupsi Tukin ASN Kementerian ESDM, Temukan Uang Miliaran Rupiah",2023-03-28 22:44:00
Kuasa Hukum Bantah Wamenkumham Minta Asprinya Jadi Komisaris PT CLM,2023-03-28 22:40:00
"Kritik Ucapan Mekeng ""Makan Uang Haram Kecil-kecil"", KPK: Sedikit atau Banyak Tidak Layak",2023-03-28 22:19:00
Komisi Yudisial Kutuk Pembacokan Mantan Ketua KY Jaja Ahmad Jayus,2023-03-28 22:13:00
"Persoalan Piala Dunia U-20, Muhadjir: Kita Masih Berusaha Mencari Titik Temu",2023-03-28 22:09:00
"Bupati Kapuas Tersangka, KPK Wanti-wanti Kepala Daerah Tak Manfaatkan Jabatan untuk Urusan Pribadi",2023-03-28 21:44:00
Pengacara Sebut Pemerintah Harus Beri Santunan untuk Korban Gagal Ginjal Meninggal dan Rawat Jalan,2023-03-28 21:11:00
Komisi X Dukung Pemerintah Lobi FIFA agar Piala Dunia U-20 Tetap Digelar di Indonesia,2023-03-28 21:04:00
Pernyataan Lengkap Jokowi soal Polemik Timnas Israel di Piala Dunia U20,2023-03-28 20:52:00
Plt Menpora Muhadjir: Jangan Sampai Seolah-olah Kalau U-20 Batal Indonesia Mau Kiamat,2023-03-28 20:52:00
"PAN Dorong Kader Bagi-bagi Sembako di Tempat Ibadah, Waketum: Malah Disarankan",2023-03-28 20:47:00
"Panggil Mahfud dan Kepala PPATK Besok soal Transaksi Janggal, Komisi III DPR: Pasti Panas!",2023-03-28 20:40:00
"Beri Penghormatan Saat Jokowi Lewat, Raul Siswa SD Asal Papua Dapat Penghargaan dari Pangdam",2023-03-28 20:37:00
"FIFA Batalkan ""Drawing"" Piala Dunia U-20, Komisi X: Pemerintah Harus Cepat Bersikap",2023-03-28 20:35:00
"Meski Sebut Koalisi Cair, Golkar Masih Ngotot Jadikan Airlangga Capres",2023-03-28 20:22:00
"Jokowi: Saat Ditunjuk Jadi Tuan Rumah Piala Dunia U20, RI Belum Tahu Timnas Israel Lolos",2023-03-28 20:21:00
"Kritik Mensos Risma, Pihak Korban Gagal Ginjal: Kunjungi Pasien yang Lumpuh pun Tidak",2023-03-28 20:16:00
"Komisi III DPR Pilih 3 dari 9 dari Calon Hakim Agung, Triyono yang Viral Hartanya Meroket Tidak Lolos",2023-03-28 20:12:00
"Airlangga Sempat Berbincang 1 Jam Dengan Surya Paloh, Ace: Kan Nasdem Bin Golkar",2023-03-28 20:08:00
"Polemik Timnas Israel di Piala Dunia U20, Jokowi: RI Konsisten Dukung Palestina Merdeka",2023-03-28 20:00:00
Menkes Berencana Bawa Masalah Santunan Gagal Ginjal Akut ke Presiden,2023-03-28 19:58:00
"Jokowi Minta Indonesia Lepas dari ""Middle Income Trap"" pada 2030",2023-03-28 19:53:00
"Kabareskrim: Keponakan Wamenkumham Sudah Tersangka, tapi Masih Mangkir Panggilan",2023-03-28 19:47:00
Jokowi Sependapat dengan Dubes Palestina soal Keikusertaan Israel di Piala Dunia U-20,2023-03-28 19:44:00
"Ceritakan Proses Bidding Jadi Tuan Rumah U20, Jokowi: Semua Kerja Keras Agar Indonesia Bisa",2023-03-28 19:41:00
"Soal Nasib Tuan Rumah Piala Dunia U-20, Jokowi: Saya Utus Erick Thohir Temui FIFA",2023-03-28 19:40:00
"Sepakat dengan Dubes Palestina, Jokowi: Jangan Campur Adukkan Urusan Olahraga dengan Politik",2023-03-28 19:35:00
"Saling Lempar Santunan Korban Gagal Ginjal, Mensos hingga Menkes Dicap Tidak Santun",2023-03-28 19:32:00
Jokowi: Keikutsertaan Timnas Israel di Piala Dunia U20 Tak Pengaruhi Dukungan RI ke Palestina,2023-03-28 19:31:00
Jokowi: FIFA Tahu Ada Penolakan terhadap Keikutsertaan Israel,2023-03-28 19:31:00
"Calon Hakim Agung Triyono Martanto Jelaskan Kenapa Bisa Hartanya Meroket Hingga Rp 51,2 M",2023-03-28 19:26:00
Bupati Kapuas Diduga Pakai Uang Hasil Korupsi Untuk Bayar 2 Lembaga Survei Nasional,2023-03-28 19:18:00
"Ditanya Sikap Golkar Terkait Penolakan Israel di Piala Dunia U-20, Airlangga: Saya Ketum Wushu",2023-03-28 19:08:00
"Update 28 Maret: Kasus Covid-19 Bertambah 511 Dalam Sehari, Totalnya Jadi 6.744.873",2023-03-28 19:07:00
Pemerintah Akan Masukan RPJMN 2025-2045 ke DPR untuk Disahkan Jadi UU,2023-03-28 19:06:00
Menkes Disomasi Forum Dokter Gara-gara Sebut Biaya Izin Praktek Capai Rp 1 Triliun,2023-03-28 18:51:00
"Triyono Martanto Akui 3 Kali Ikut ""Fit and Proper Test"" Calon Hakim Agung di DPR",2023-03-28 18:43:00
Duit Korupsi Bupati Kapuas Diduga Digunakan untuk Loloskan Istrinya Jadi Anggota DPR RI,2023-03-28 18:37:00
KPK Tahan Bupati Kapuas dan Istrinya Selama 20 Hari,2023-03-28 18:31:00
"Soal KIB Melebur ke Koalisi Perubahan, Ketum Golkar: Kayak Cendol Saja",2023-03-28 18:30:00
"Spesifikasi Kapal La Fayette yang Singgah di Jakarta, Dijuluki Fregat Siluman dan Anti-Kapal Selam",2023-03-28 18:24:00
"Survei SMRC: Sentimen Positif terhadap Keamanan RI Merosot, Kini 51,7 Persen",2023-03-28 18:05:00
Kabareskrim Sebut Sebagian Senjata Api Dito Mahendra Tidak Berizin,2023-03-28 17:57:00
"Anggota Komisi III Minta Calon Hakim Agung Triyono Martanto Jelaskan Asal Usul Harta Rp 51,2 Miliar Miliknya",2023-03-28 17:57:00
"Hakim Setujui Format Pengumuman Gugatan Korban Gagal Ginjal Akut, Pengacara akan Iklan di Media Massa",2023-03-28 17:51:00
"Kisah Ustazah Yuyun di Cianjur, 26 Tahun Mengajar Tanpa Gaji",2023-03-28 17:44:00
"JK Kemungkinan Arahkan Golkar Bikin Koalisi Besar dengan Gabung KPP, PDI-P: Mampu Enggak?",2023-03-28 17:44:00
DJP Diminta Lakukan Digitalisasi Cegah Permainan Petugas-Wajib Pajak,2023-03-28 17:21:00
Sistem Pemungutan Pajak Secara Manual Dinilai Rawan Kongkalikong,2023-03-28 17:21:00
"Survei SMRC: Kondisi Politik Nasional Dinilai Memburuk 3,5 Tahun Terakhir",2023-03-28 17:20:00
Anggota Komisi XI Sebut Banyak Pejabat Pajak Bermental Mafia,2023-03-28 17:06:00
"Plt Menpora: Insya Allah FIFA Paham dengan Indonesia, Mudah-mudahan Tidak Ada Sanksi yang Seram",2023-03-28 17:02:00
Kemenlu Cek Kemungkinan Adanya Korban WNI dalam Kecelakaan Bus Jemaah Umrah di Arab,2023-03-28 16:59:00
Jokowi Kantongi Nama Calon Kepala BNPT Pengganti Boy Rafli Amar,2023-03-28 16:57:00
Koreksi Sistem Penegakan Hukum Pemilu Pasca-Putusan Perdata Kontroversial,2023-03-28 16:55:00
"Dibawa 2 Kapal Perang, 120 Prajurit AD Perancis Akan Latihan Bersama Pasukan Kostrad di Depok",2023-03-28 16:27:00
"Tersangka Korupsi Bupati Kapuas dan Istrinya Diperiksa di KPK, Ini Pemanggilan Kedua",2023-03-28 16:21:00
PKS Sebut Khofifah Punya Tiga Kekuatan untuk Cawapres Anies,2023-03-28 16:20:00
"Melchias Mekeng Sebut Tak Apa Makan Uang Haram Kecil-Kecilan, KPK: Tidak Mencerdaskan",2023-03-28 16:14:00
"Profil Ary Egahni Ben Bahat, Anggota DPR Istri Bupati Kapuas yang Jadi Tersangka KPK",2023-03-28 16:09:00
"2 Kapal Perang AL Perancis LHD Dixmude dan La Fayette Singgah di Jakarta, Bawa 120 Prajurit",2023-03-28 16:07:00
"Said Abdullah Bagi-bagi Amplop, PDI-P: Kalau Tanpa Logo Partai, Enggak Protes Toh?",2023-03-28 16:05:00
"Kekayaan Presiden Jokowi Naik Rp 10 Miliar Jadi Rp 82,3 Miliar dalam LHKPN 2022",2023-03-28 15:55:00
KPK Tegaskan Tak Pernah Tangani Perkara Dugaan Gratifikasi Lili Pintauli,2023-03-28 15:42:00
KPK Temukan Dokumen Pencairan Fiktif Tukin ASN di Kementerian ESDM,2023-03-28 15:38:00
"Perusahaan Wajib Beri THR bagi Pekerja Tak Dicicil, Ini Rincian Hitungannya",2023-03-28 15:37:00
Deretan Harta Melchias Mekeng yang Sebut Pejabat Boleh Terima Uang Haram,2023-03-28 15:25:00
Tim Penyidik KPK Geledah Kantor Bupati Kapuas,2023-03-28 15:25:00
"Profil Ben Brahim S Bahat, Bupati Kapuas yang Jadi Tersangka Korupsi",2023-03-28 15:15:00
PKS Sebut Usulan Jusuf Kalla soal Cawapres Anies Layak Dipertimbangkan,2023-03-28 15:13:00
"Kontras Minta DPR Tolak 3 Calon Hakim Ad Hoc HAM, Ini Alasannya",2023-03-28 14:55:00
"Polri Imbau Warga Tidak Mudik Lebaran 2023 Naik Motor, Rawan Kecelakaan",2023-03-28 14:46:00
Istri Bupati Kapuas yang Jadi Tersangka KPK Mundur dari Nasdem,2023-03-28 14:42:00
KPK Nilai Gugatan MAKI Terkait Lili Pintauli Tidak Jelas,2023-03-28 14:42:00
"Laporkan Menko Polhukam, Menkeu, dan Kepala PPATK, MAKI: Mudah-mudahan Ditolak Polisi",2023-03-28 14:40:00
"Respons soal Kabar Kalla Ajak Golkar Merapat KPP, PAN: Ajak-mengajak Kan Biasa",2023-03-28 14:33:00
"Satu Anggota Komisi III Jadi Tersangka KPK, Bambang Pacul: Kita Berduka, tapi Tak Bisa Apa-apa",2023-03-28 14:31:00
"Harta Bupati Kapuas dan Istrinya yang Jadi Tersangka KPK Rp 8,7 Miliar",2023-03-28 14:24:00
Bareskrim Sebut Keponakan Wamenkumham Catut Nama dan Janjikan Promosi Jabatan,2023-03-28 14:18:00
"Menaker: THR Diberikan Paling Lambat 7 Hari Sebelum Lebaran, Tak Boleh Dicicil",2023-03-28 14:16:00
Jokowi Minta Dana Zakat di Baznas Disalurkan Tepat Sasaran,2023-03-28 14:14:00
"Bupati Kapuas dan Istri Diduga ""Potek"" Gaji PNS, Dibuat Seolah-olah Utang",2023-03-28 14:12:00
"Istri Bupati Kapuas yang Jadi Tersangka Kader Nasdem, Tak Dapat Pendampingan Hukum Partai",2023-03-28 14:10:00
Survei SMRC: Anies Bakal Capres yang Tak Mungkin Lanjutkan Program Jokowi,2023-03-28 13:50:00
KPK Cegah Bupati Kapuas dan Istrinya yang Anggota DPR RI ke Luar Negeri,2023-03-28 13:46:00
"Jadi Tersangka, Bupati Kapuas dan Istrinya Anggota Komisi III DPR Diperiksa KPK",2023-03-28 13:44:00
KPK Nilai MAKI Tak Miliki “Legal Standing” Ajukan Praperadilan Terkait Lili Pintauli,2023-03-28 13:35:00
Menkes Disomasi Usai Sebut Biaya Perpanjangan STR dan SIP Dokter Rp 6 Juta,2023-03-28 13:31:00
"KPK: Hasil Analisis PPATK Bersifat Intelijen, Seharusnya Tak Diobral di Ruang Publik",2023-03-28 13:20:00
Mahfud: Enggak Ada Pembocoran Informasi soal Transaksi Janggal,2023-03-28 13:17:00
Kemenag-DPR-BPKH Rapat Tertutup Bahas Tambahan Biaya Haji Rp 256 Miliar,2023-03-28 13:15:00
KPK Tetapkan Bupati Kapuas Kalteng dan Anggota DPR RI sebagai Tersangka,2023-03-28 13:04:00
"DKPP Susun Putusan untuk Ketua KPU Terkait Kasus ""Wanita Emas""",2023-03-28 12:57:00
Nasdem Sebut Elektabilitasnya Naik karena Ada Sumbangan Efek Ekor Jas dari Anies,2023-03-28 12:46:00
Survei SMRC: Ganjar Kandidat Capres yang Paling Mungkin Lanjutkan Program Jokowi,2023-03-28 12:33:00
"Tukin Kementerian Diduga Dikorupsi, Menteri ESDM: Pengawasan Harus Lebih Ketat",2023-03-28 12:24:00
DKPP Segera Gelar Sidang Putusan Dugaan Kecurangan KPU Terkait Verifikasi Parpol,2023-03-28 12:18:00
Mahfud MD Siap Beri Penjelasan soal Transaksi Janggal kepada DPR Besok,2023-03-28 12:13:00
"Bertemu Prabowo di Kantor Kemenhan, Sandiaga: Yang Kami ""Omongin"" Banyak...",2023-03-28 12:12:00
"Nasdem Akui Ajak JK Diskusi Kandidat Cawapres Anies, Tak Hanya Satu Nama Diusulkan",2023-03-28 12:08:00
BPOM: Tak Ada Obat Mengandung Pholcodine yang Terdaftar di Indonesia,2023-03-28 11:58:00
"Cuti Bersama Lebaran Maju, Korlantas Prediksi Kepadatan Arus Mudik Terjadi mulai 18 April",2023-03-28 11:51:00
"DKPP Sebut Anggaran Rp 26 Miliar untuk 2023 Sudah Habis, Tak Bisa Selenggarakan Sidang ""Offline"" Lagi",2023-03-28 11:50:00
MAKI Ajukan Arteria Dahlan dan 2 Anggota DPR Lain Jadi Ahli Terkait Laporannya,2023-03-28 11:46:00
"Elektabilitas Erick Thohir sebagai Cawapres Meningkat, PAN Puji Kinerjanya",2023-03-28 11:39:00
"Israel di Piala Dunia U-20: Ditolak Politisi, Tidak Dipersoalkan Palestina",2023-03-28 11:35:00
Arteria Enggan Terima Tantangan Mahfud: Beliau Saya Anggap Guru dan Orangtua,2023-03-28 11:31:00
"Survei SMRC: Kepuasan Publik terhadap Kerja Jokowi Naik, Kini Capai 75 Persen",2023-03-28 11:27:00
"Jokowi: Saya Imbau Pejabat Negara, ASN, Kepala Daerah Bayar Zakat lewat Baznas",2023-03-28 11:24:00
"Lanud Soewondo Medan Bakal Direlokasi, Luhut Minta Teknis Pembebasan Lahan Segera Dibuat",2023-03-28 11:18:00
"Polri: Pemudik Lebaran 2023 Diprediksi Meningkat, Bisa Capai 123,8 Juta Orang",2023-03-28 10:54:00
"MAKI Laporkan Menko Polhukam, Menkeu, dan Kepala PPATK ke Bareskrim Siang Ini",2023-03-28 10:31:00
Imigrasi Australia Sarankan Indonesia Deteksi Dini Orang Asing Jauh Sebelum Mereka Tiba,2023-03-28 10:07:00
Panglima TNI Berangkatkan 850 Personel Satgas Monusco untuk Misi Perdamaian di Kongo,2023-03-28 09:59:00
"KPK Ungkap Modus Korupsi Beras Bansos, Seolah Sudah Didistribusikan padahal Tidak",2023-03-28 09:51:00
"Kronologi Kabar Dugaan Transaksi Janggal Rp 349 Triliun di Kemenkeu, Bermula dari Mahfud MD",2023-03-28 09:40:00
"Survei Litbang ""Kompas"": Elektabilitas Ganjar, Prabowo, dan Anies Lebih Kecil di Kalangan Perempuan",2023-03-28 09:40:00
"Hari Ini, KPK dan Dewas Beri Jawaban Gugatan Praperadilan MAKI Terkait Lili Pintauli",2023-03-28 09:29:00
Dugaan Korupsi Tukin di Kementerian ESDM: Uang Puluhan Miliar Rupiah untuk Beli Aset dan Suap Pemeriksaan BPK,2023-03-28 09:14:00
"Survei Litbang ""Kompas"": Tokoh dengan Pribadi Sederhana Jadi Daya Tarik bagi Perempuan Memilih Capres",2023-03-28 09:03:00
"Polemik Hotel Sultan, Kuasa Hukum PT Indobuildco: Status HGB No 26/Gelora dan HGB No 27/Gelora Sah di Mata Hukum",2023-03-28 09:01:00
Saat Sri Mulyani Jawab Dugaan Transaksi Janggal Rp 349 Triliun: Kaget hingga Klaim Tak Semua Terkait Kemenkeu,2023-03-28 08:55:00
Saat Keponakan Wamenkumham Resmi Jadi Tersangka Buntut Pencatutan Nama untuk Minta Uang...,2023-03-28 08:25:00
"Nasib Santunan Gagal Ginjal Akut: Sempat Saling Lempar, Akhirnya Dibahas Empat Kementerian",2023-03-28 08:11:00
"Pemerintah Lobi FIFA soal Israel: Sudah Ajukan Syarat, tapi Tidak Diterima",2023-03-28 07:17:00
Kajian TII: Penanganan Pandemi Covid-19 Dominan ke Pemulihan Ekonomi Jadi Sebab Kasus Melonjak,2023-03-28 07:09:00
Saat Jokowi Beri Perintah ke PPATK dan Mahfud MD soal Kehebohan Transaksi Janggal di Kemenkeu...,2023-03-28 06:36:00
"Penggugat Berharap MK Sidangkan ""Judicial Review"" Pasal Pemilu Susulan atau Lanjutan secara Cepat",2023-03-28 05:48:00
[POPULER NASIONAL] Hasil Survei Anies Menurun-Prabowo Rebound | Kriminalisasi Budi Pego Tak Masuk Akal,2023-03-28 05:30:00
"Survei SMRC: Masyarakat Nilai Kinerja Jokowi Positif Cenderung Pilih Ganjar, Negatif Dukung Prabowo",2023-03-28 05:23:00
"Pasal Pemilu Susulan dan Lanjutan Digugat, Dikhawatirkan Celah Perpanjang Jabatan Presiden",2023-03-28 05:21:00
"Tanda Tanya Koalisi Besar Golkar, Merapat ke KPP atau Tetap Bersama KIB?",2023-03-28 05:00:00
Sosok Melchias Mekeng yang Singgung Uang Haram dan Bolak-balik Diperiksa KPK,2023-03-28 04:09:00
Penghayatan Kolektif Ramadhan,2023-03-28 04:00:00
Survei Indikator: Pemerintahan di 2024 Diharap Kendalikan Harga Sembako hingga Berantas Korupsi,2023-03-28 03:55:00
Seloroh Melchias Mekeng di Raker Kemenkeu: Makan Uang Haram Kecil Enggak Apa-apa,2023-03-28 03:46:00
Aksi Bripka Handoko dan Polisi yang Diharapkan Masyarakat,2023-03-28 02:58:00
"Kepercayaan Publik ke Polri Meningkat, Komisi III Berencana Naikkan Anggaran",2023-03-27 23:29:00
Hinca: Sejak 2013 Sampai Sekarang Tidak Ada Hakim Agun Perempuan Kamar TUN dan Pajak,2023-03-27 23:22:00
Kemenkes Sebut Larangan Bukber ASN Bukan Karena Kasus Covid-19 Naik: Karena Pamer Gaya Hidup,2023-03-27 23:17:00
Bareskrim Ungkap Alasan Pelaku Jual Video Porno Anak Laki-laki: Lebih Laku,2023-03-27 23:11:00
Bareskrim Ungkap Modus Pelaku Pornografi Anak: Diberi Snack hingga Uang,2023-03-27 22:53:00
"Usai Saling Lempar, Kini Persoalan Santunan Gagal Ginjal Akut Dibahas Empat Kementerian",2023-03-27 22:33:00
"Meski Tak Jadi Syarat Mudik, Kemenkes Imbau Warga Tetap Lakukan Vaksinasi Booster",2023-03-27 22:28:00
"""Kick Off"" Penyelesaian Non Yudisial Pelanggaran HAM Berat Masa Lalu Dimulai Setelah Lebaran",2023-03-27 22:19:00
Polri Bakal Maksimalkan Pengawasan Aktivitas Impor Ilegal di Pintu Masuk,2023-03-27 21:35:00
Kemenkes Tegaskan Obat dan Alkes Pasien Gagal Ginjal Akut Masih Ditanggung BPJS,2023-03-27 21:19:00
Dugaan Korupsi Cukai Rokok di Tanjung Pinang Rugikan Negara Lebih Rp 250 M,2023-03-27 21:06:00
Komisi III Bakal Soroti Kekayaan dan Isu Plagiarisme Calon Hakim Agung Triyono Martanto di Fit And Proper Test,2023-03-27 21:05:00
"Singung Potensi Wisatawan, Sandiaga Harap Piala Dunia Tetap Digelar di Indonesia",2023-03-27 20:40:00
"Besok, MAKI Laporkan Kepala PPATK, Mahfud MD dan Sri Mulyani ke Bareskrim Polri",2023-03-27 20:36:00
Menko Mahfud Persilakan Komnas HAM Usut Lagi Tragedi Kanjuruhan,2023-03-27 20:15:00
Politikus Demokrat Curiga Mahfud Punya Motif Politik di Balik Laporan Transaksi Rp 349 T,2023-03-27 19:51:00
"Jokowi Minta Buka-bukaan soal Transaksi Janggal Kemenkeu, Mahfud: Jangan Ditutupi!",2023-03-27 19:49:00
"Pro dan Kontra Partisipasi Israel di Piala Dunia U-20, Mahfud: Kita Jalani untuk Cari Jalan Keluar",2023-03-27 19:47:00
Wamenkumham Akan Diperiksa Terkait Laporan yang Dibuat Asprinya,2023-03-27 19:37:00
"Kampanye di Rumah Ibadah dan Politik Uang, Peserta Pemilu Siap-siap Terima Hukuman Ini",2023-03-27 19:33:00
"Polemik Larangan Buka Bersama, Jokowi: Ini Bukan untuk Masyarakat Umum!",2023-03-27 19:13:00
"Update 27 Maret 2023: Kasus Covid-19 Bertambah 329 dalam Sehari, Total Capai 6.744.362",2023-03-27 19:05:00
Kemendagri Harap Verifikasi Ulang Prima Tak Usik Tahapan Pemilu 2024,2023-03-27 19:02:00
"Belum Komunikasi dengan PKS soal Anies-Sandi, PPP Sebut KIB Mulai Bergerak Setelah Ramadhan",2023-03-27 18:54:00
KPK Duga Uang Korupsi Tukin di ESDM untuk Suap Pemeriksaan BPK,2023-03-27 18:37:00
Jokowi Minta Anggaran Buka Bersama Pemerintah Dialihkan untuk Santuni Fakir Miskin hingga Yatim Piatu,2023-03-27 18:32:00
DPR Merasa Belum Perlu Undang Prima Saat Bahas Kasus Hukum Mereka,2023-03-27 18:25:00
Menteri ESDM Hormati Penyidikan Dugaan Korupsi Tukin yang Dilakukan KPK,2023-03-27 18:05:00
Jokowi-Mahfud MD Bicara Empat Mata Soal Dugaan Pencucian Uang di Kemenkeu,2023-03-27 17:57:00
KPK Dalami Keterkaitan Kementerian Keuangan dengan Dugaan Korupsi Tukin di ESDM,2023-03-27 17:53:00
"Sri Mulyani Jawab soal Dugaan Transaksi Janggal, Klaim Rp 349 Triliun Tak Seluruhnya Menyangkut Kemekeu",2023-03-27 17:50:00
"Jokowi: Larangan Buka Puasa Bersama Hanya untuk Internal Pemerintah, Bukan Masyarakat Umum",2023-03-27 17:46:00
"Erick Thohir Akan ke Zurich, Lobi FIFA Soal Timnas Israel di Piala Dunia U-20",2023-03-27 17:43:00
"Soal Wacana Duetkan Anies-Sandi, PPP Mengaku Belum Berkomunikasi dengan PKS",2023-03-27 17:42:00
"Bareskrim Tangkap 3 Tersangka Kasus Pornografi Anak di Jatim, Jabar, dan Jateng",2023-03-27 17:40:00
"Koster dan Ganjar Tolak Timnas Israel U-20, Ketua Komisi X: Terlambat, Harusnya sejak 2019",2023-03-27 17:31:00
Jokowi Minta Pemerintah Segera Tentukan Sikap soal Kelanjutan Pembahasan RUU Kesehatan,2023-03-27 17:29:00
Prima Kecewa Tak Pernah Dilibatkan saat DPR Bahas Kasus Hukum Mereka,2023-03-27 17:24:00
Menag Targetkan Keppres Biaya Haji Terbit Sebelum Lebaran,2023-03-27 17:17:00
Pemerintah Belum Siapkan Rencana jika Indonesia Batal Jadi Tuan Rumah Piala Dunia U-20,2023-03-27 17:13:00
Survei Indikator Ungkap Kejagung Dipercaya Publik karena Konsisten Usut Korupsi,2023-03-27 17:11:00
Survei Indikator: Kejagung Penegak Hukum Paling Dipercaya Publik,2023-03-27 17:11:00
"KPK Buka Penyidikan Dugaan Korupsi Pengaturan Cukai Rokok, Capai Ratusan Miliar Rupiah",2023-03-27 17:11:00
Bareskrim Tetapkan Keponakan Wamenkumham Jadi Tersangka Pencemaran Nama Baik,2023-03-27 17:08:00
"Kagetnya Sri Mulyani, Mahfud MD Tiba-tiba Ungkap Dugaan Transaksi Janggal Rp 300 Triliun di Kemenkeu",2023-03-27 17:00:00
"Anggap Tak Konsisten atas Putusan Prima, Komisi II Panggil Bawaslu",2023-03-27 16:58:00
Kemenkes Klaim RUU Kesehatan Akan Buat RI Tak Bergantung pada Obat dan Alkes Impor,2023-03-27 16:56:00
KPK: Tersangka Korupsi di Kementerian ESDM Pangkas Tukin dan Nikmati Puluhan Miliar Rupiah,2023-03-27 16:55:00
MAKI Gugat Praperadilan KPK terkait Kasus “Kardus Durian”,2023-03-27 16:52:00
Pemenjaraan Budi Pego Disebut Mencederai Wajah Mahkamah Agung,2023-03-27 16:43:00
Survei Indikator: Vonis Sambo Pulihkan Keyakinan Penegakan Hukum,2023-03-27 16:40:00
"Dipanggil ke Propam Polri, Pelapor Kasus Brimob Gaduh di Sidang Kanjuruhan Serahkan Bukti Tambahan",2023-03-27 16:33:00
Pemerintah Lobi FIFA soal Partisipasi Timnas Israel di Piala Dunia U20,2023-03-27 16:27:00
KPK Ungkap Ada Penyalahgunaan Wewenang dalam Penetapan Tukin di Kementerian ESDM,2023-03-27 16:27:00
Jusuf Kalla Beri Arahan untuk Usung Anies Capres? Ini Kata Golkar,2023-03-27 16:23:00
MAKI Nilai KPK Hentikan Penyidikan Dugaan Gratifikasi Lili Pintauli secara Tidak Sah,2023-03-27 16:13:00
Tim Anies Tetap Akan Pertimbangkan Tokoh NU dan Muhammadiyah sebagai Cawapres,2023-03-27 16:11:00
Survei Indikator: Hanya Mukjizat Bisa Ubah Elektabilitas Ganjar-Anies-Prabowo dari 3 Besar,2023-03-27 16:03:00
Menteri ESDM Akui Ada Dugaan Korupsi Tunjangan Kinerja di Instansinya,2023-03-27 16:01:00
Menag Minta Tambahan Biaya Rp 200 Miliar untuk Jemaah Haji 2020 dan 2022,2023-03-27 15:57:00
KPK Pastikan Sudah Tetapkan Sejumlah Tersangka dalam Dugaan Korupsi Tukin di Kementerian ESDM,2023-03-27 15:53:00
Menpan-RB: THR ASN Minimal H-5 Lebaran Sudah Cair,2023-03-27 15:48:00
"Soal Brimob Gadung di Sidang Kasus Kanjuruhan, Pelapor Minta Mabes Tak Limpahkan ke Polda Jatim",2023-03-27 15:48:00
"Berkaca pada Popularitas Ginseng Korsel, Kemenkes Atur Pemanfaatan Obat Herbal Indonesia di RUU Kesehatan",2023-03-27 15:44:00
"Penolakan Timnas Israel Dinilai Tak Berdasar, Pakar Singgung Ajang IPU 2022 di Bali",2023-03-27 15:43:00
Menaker: THR Paling Lambat Dibayarkan H-7 Lebaran,2023-03-27 15:35:00
Survei Indikator: Elektabilitas Gerindra Melejit Imbas Naiknya Elektoral Prabowo,2023-03-27 15:27:00
"Selain Partai Koalisi Jokowi, PBB Bakal Jajaki Kunjungan Ke Partai Koalisi Pengusung Anies",2023-03-27 15:19:00
Anggota DPR Pertanyakan Keppres Biaya Haji yang Tak Kunjung Diterbitkan Pemerintah,2023-03-27 15:19:00
"Bertemu Jokowi di Istana, Lenis Kogoya Sampaikan Dukungan untuk Prabowo Capres",2023-03-27 15:01:00
Bawaslu: Apa Pun Berupa Lambang Partai di Tempat Ibadah Tak Diperkenankan,2023-03-27 14:48:00
"Survei Indikator: Elektabilitas Nasdem Tertinggi dalam Sejarah, Efek Deklarasi Anies Capres",2023-03-27 14:46:00
Menagih Pertanggungjawaban Korporasi Menekan Hoaks,2023-03-27 14:42:00
Mahfud Disebut Bermain Politik jika Tak Tuntaskan soal Transaksi Mencurigakan di Kemenkeu,2023-03-27 14:39:00
"Istri Pamer Kekayaan, Pegawai Ditjen Hubla Rizki Alamsyah Mengaku ""Cuma"" Punya Rp 1,48 M",2023-03-27 14:33:00
Golkar Akui Pertemuan Airlangga dan Surya Paloh Perdalam Kemungkinan Koalisi Besar,2023-03-27 14:25:00
"Soal Penyanderaan Pilot Susi Air, Lenis Kogoya Minta Kelompok Egianus Hentikan Kekerasan di Papua",2023-03-27 14:22:00
"Tingkat Kepercayaan ke Polri Meningkat, Kompolnas: Harus Jadi Pemicu untuk Semakin Baik",2023-03-27 14:07:00
Evaluasi Mudik Lebaran Tiap Tahun yang Tidak Pernah Selesai dari Masalah,2023-03-27 13:59:00
Kejagung Perpanjang Masa Tahanan 5 Tersangka Kasus Korupsi BTS 4G Bakti Kominfo,2023-03-27 13:59:00
"Jawab Tantangan Mahfud, Benny K Harman: Saya Pasti Datang",2023-03-27 13:51:00
"Survei Indikator: Elektabilitas PDI-P Turun, Gerindra hingga Nasdem Naik Tajam",2023-03-27 13:49:00
"KPK Disebut Jarang Tangani Kasus Besar oleh Dewas, Firli: Terima Kasih atas Penilaiannya",2023-03-27 13:40:00
Penggeledahan KPK di Ditjen Minerba Kementerian ESDM Terkait Kasus Baru,2023-03-27 13:35:00
"PBNU Tak Mau Diseret soal Pencarian Cawapres Anies, Sudirman Said: Kita Hormati",2023-03-27 13:27:00
"MRT Hadirkan Lagi Kereta Khusus Perempuan, Hanya Berlaku Saat Jam Sibuk",2023-03-27 13:24:00
"Soal Penolakan Timnas Israel U-20, Gubernur Bali: Itu Bukan Sikap Saya, tapi...",2023-03-27 13:18:00
"Sayangkan Sikap Politikus Tolak Timnas Israel, Pengamat: Yang Ditentang Harusnya Kebijakan Zionis Israel",2023-03-27 13:09:00
"Survei Litbang ""Kompas"", Pemerintah dan Penyelenggara Dinilai Belum Tegas soal Penundaan Pemilu",2023-03-27 13:05:00
"Survei Indikator: Elektabilitas Erick Thohir Naik Signifikan di Bursa Cawapres, tapi Bukan yang Teratas",2023-03-27 12:58:00
KPK Geledah Kantor Kementerian ESDM,2023-03-27 12:56:00
Bawaslu: Politik Uang dan Kampanye di Tempat Ibadah Masuk Pidana Pemilu,2023-03-27 12:51:00
Duduk Perkara KPK Tegur Ditjen Bea Cukai yang Panggil Pembocor Skandal Dugaan Korupsi IMEI,2023-03-27 12:51:00
"Kepercayaan Publik Meningkat, Polri Janji Terus Evaluasi",2023-03-27 12:48:00
"Didampingi Kapolri, Jokowi Bertemu PP Pemuda Muhammadiyah di Istana",2023-03-27 12:38:00
"Said Abdullah Bantah Amplop yang Dibagikan di Masjid Terkait Kampanye, tapi Rutinitas",2023-03-27 12:26:00
"Survei Indikator, Kepercayaan Publik ke Polri Terus Meningkat, Kini Capai 70,8 Persen",2023-03-27 12:23:00
"Survei Indikator Elektabilitas Cawapres: Ridwan Kamil Turun, Erick Thohir hingga AHY Naik",2023-03-27 12:17:00
Dewas Berharap KPK Lebih Berani Usut Kasus Korupsi yang Besar,2023-03-27 12:10:00
Motif Pengubahan Substansi Putusan MK Dinilai Perlu Diungkap Polisi,2023-03-27 11:54:00
"Proses Etik Selesai, Jokowi Diharap Izinkan Polisi Periksa Hakim MK",2023-03-27 11:42:00
"Pembagian Sembako di Madura Disebut Money Politics, Said Abdullah: Salah Alamat",2023-03-27 11:36:00
"Bertemu Jokowi Satu Jam, Kepala PPATK: Banyak yang Dibicarakan, Saya Dapat Arahan...",2023-03-27 11:34:00
Keengganan PBNU Masuk dalam Riuhnya Pencarian Cawapres Anies Baswedan,2023-03-27 11:20:00
"Bagi-bagi Amplop di Masjid, Said Abdullah Bantah Politik Uang: Masa Kampanye Saja Belum",2023-03-27 11:16:00
"9 Calon Hakim Agung dan Hakim ""Ad Hoc"" Jalani ""Fit and Proper Test"" di DPR",2023-03-27 11:13:00
Bawaslu Telusuri Dugaan Pelanggaran Kader PDI-P Bagi-bagi Amplop di Masjid,2023-03-27 11:06:00
Kepala PPATK Datang ke Istana Kepresidenan untuk Bertemu Jokowi,2023-03-27 10:57:00
"Survei Litbang ""Kompas"": 82,8 Persen Publik Anggap Pemilu 2024 Tak Perlu Ditunda",2023-03-27 10:31:00
Kriminalisasi Berulang Budi Pego yang Tak Masuk Akal...,2023-03-27 09:35:00
"Ketua Dewas: Kasus-kasus ""The Big Fish"" Jarang Ditangani KPK",2023-03-27 09:12:00
Saat KPK Ingin Mahfud Fokus ke RUU Perampasan Aset ketimbang Beri Info Setengah-setengah soal Rp 349 T,2023-03-27 08:49:00
"Harta Triyono Martanto, Pejabat Ditjen Pajak yang Jadi Calon Hakim Agung, Capai Rp 51,2 M",2023-03-27 07:00:00
"Sidang Gugatan MAKI Terkait Lili Pintauli Digelar Hari Ini, KPK dan Dewas Diingatkan Hadir",2023-03-27 06:49:00
