Article,Date
"Polri Persilakan Keluarga Tahanan Kunjungi Rutan Bareskrim, Maksimal 5 Orang Selama 30 Menit",2023-04-20 14:46:00
KPK Sudah Terjunkan Tim Cek Aset Sekda Riau di 7 Lokasi,2023-04-20 14:27:00
"Cek Ketersediaan BBM Selama Arus Mudik, Menteri ESDM Sebut Stok di SPBU Cukup dan Pelayanan Baik",2023-04-20 14:21:00
"Bupati Meranti Gadaikan Kantor ke Bank, KPK Bisa Saja Usut Perkara Baru jika Ada Bukti",2023-04-20 13:40:00
Menyelisik Filosofi Logo IKN Rancangan Wildan Ilham yang Berhasil Tembus Nominasi 5 Besar,2023-04-20 13:37:00
"PDI-P, Gerindra, dan Golkar Ngotot Usung Capres, Koalisi Besar Sulit Terwujud?",2023-04-20 13:22:00
57 Tahanan KPK Akan Shalat Idul Fitri di Masjid Rutan Pomdam Jaya Guntur,2023-04-20 13:14:00
"Pelabuhan Ciwandan Kembali Beroperasi untuk Lebaran 2023, Pemerintah Klaim Lebih Baik",2023-04-20 12:59:00
"Per Pukul 10.00 WIB, ""Contraflow"" Diberlakukan di Tol Japek dan Buka Tutup di Km 27 Tol MBZ",2023-04-20 12:53:00
"""One Way"" Km 72 Tol Cipali sampai Km 414 Tol Kalikangkung Diperpanjang hingga Pukul 24.00 WIB",2023-04-20 12:21:00
"JPU Ajukan Banding Kasus AG, Anggota Komisi III: Sudah Sesuai Prosedur",2023-04-20 12:10:00
"Konflik Memanas, Mahasiswa Papua Desak Pemerintah Lakukan Dialog Damai",2023-04-20 12:03:00
Kata PSI soal Dukungan untuk Ganjar jika PDI-P Tak Bersama Koalisi Besar,2023-04-20 11:54:00
"Survei Indikator Politik: Ridwan Kamil Cawapres Teratas, Disusul Sandiaga Uno dan Erick Thohir",2023-04-20 11:32:00
"Konflik Papua Memanas, Komnas HAM Harap Bisa Diatasi Tanpa Korban Jiwa Lagi",2023-04-20 11:29:00
KPK Izinkan Keluarga Tahanan Kirim Makanan Saat Idul Fitri,2023-04-20 11:23:00
"Lebaran, KPK Buka Kunjungan Tatap Muka bagi Keluarga Tahanan",2023-04-20 11:17:00
"Update Terkini Penyelamatan Pilot Susi Air, 4 Prajurit TNI Gugur, 1 Dalam Pencarian",2023-04-20 11:02:00
"Lebaran di Solo, Jokowi Tak Gelar ""Open House"" Idul Fitri",2023-04-20 10:42:00
"Jika PDI-P Gabung ke Koalisi Besar, Negosiasi Capres dengan Gerindra dan Golkar Diprediksi Alot",2023-04-20 10:34:00
"Elektabilitas Ganjar Turun 7-8 Persen, Survei Indikator: Ada Efek Pembatalan Piala Dunia U20",2023-04-20 10:32:00
Sidang Isbat Penetapan Lebaran 2023 Digelar Tertutup Sore Ini,2023-04-20 10:06:00
"Gandeng Huawei dan BNI, Kemenaker Salurkan 1.500 Paket Sembako di Jatim",2023-04-20 10:04:00
"Menag Terbitkan SE, Minta Umat Islam Jaga Persaudaraan meski Mungkin Lebaran 2023 Beda Tanggal",2023-04-20 09:58:00
"Elektabilitas PDI-P Terdampak Pembatalan Piala Dunia U20, Survei Indikator: Jadi Beda Tipis dengan Gerindra",2023-04-20 09:46:00
"Survei Indikator Politik: Elektabilitas Prabowo 22,2 Persen, Ganjar 19,8 Persen",2023-04-20 09:23:00
"Jokowi Pulang Kampung Didampingi Perangkat Terbatas, Minta Anak Buah Lebaran Bersama Keluarga",2023-04-20 09:11:00
Mudik Istimewa 2023,2023-04-20 09:05:00
Kemenaker Terima 2.069 Aduan THR dari Pekerja,2023-04-20 08:57:00
"Operasi Ketupat, Polri Catat Ada 124 Kecelakaan di Tanggal 18 April 2023",2023-04-20 08:42:00
Cerita Seskab Pramono Anung Dampingi Jokowi ke Luar Negeri: Kita Enggak Pernah Lihat Restoran dan Toko,2023-04-20 08:22:00
"""One Way"" di Km 72 Tol Cipali sampai Km 414 Tol Kalikangkung Dilanjutkan hingga Pukul 12.00 WIB",2023-04-20 07:52:00
"PKS Dekati Sandiaga Uno dan Mahfud untuk Jadi ""Pengantin"" Anies, Demokrat-Nasdem Beri Peringatan",2023-04-20 07:37:00
"Asa Prima Ikut Pemilu Kembali Terbentur, Akan Beperkara dengan KPU Lagi",2023-04-20 07:17:00
"Penjelasan Pembayaran Masuk Tol Usai Pemudik Istirahat di ""Exit Toll""",2023-04-20 07:06:00
Ketika 2 Parpol Dekat Sandiaga Uno yang Terpisah Koalisi Bertemu...,2023-04-20 07:03:00
"Mudik ke Kampung Halaman, Jokowi Tetap Bekerja dari Solo",2023-04-20 06:54:00
Bawaslu Sebut Berkas Laporan Prima atas KPU Perlu Perbaikan,2023-04-20 06:46:00
"PPP Sebut Sandiaga Uno Akan Gabung pada Mei 2023, tapi Tergantung Restu Prabowo",2023-04-20 06:30:00
"Soal Syarat Capres dari PDI-P untuk Berkoalisi, Hasto: Ini Sudah Diputuskan Kongres",2023-04-20 06:19:00
"Konflik di Sudan, Kemenlu Klaim 1.209 WNI Aman dan Sudah Kirim Bantuan",2023-04-20 06:05:00
[POPULER NASIONAL] Rest Area Bukan untuk Tidur | Operasi Siaga Tempur TNI di Papua Didesak Dibatalkan,2023-04-20 05:39:00
Mereka yang Gugur dalam Pembebasan Pilot Susi Air...,2023-04-20 05:30:00
Tanggal 22 April Hari Memperingati Apa?,2023-04-20 00:00:00
KPU Siap Hadapi Lagi Gugatan Prima di Bawaslu,2023-04-19 23:16:00
"KPU Akui Ada 616.743 Data Ganda dalam DPS Pemilu 2024, Akan Dihapus Sebelum Jadi DPT",2023-04-19 23:12:00
PDI-P Dinilai Berpeluang Jadi Magnet Koalisi Besar asal Usung Ganjar,2023-04-19 23:04:00
Polri Akan Amankan Shalat Idul Fitri meskipun Jatuh pada Dua Tanggal Berbeda,2023-04-19 22:34:00
Koalisi Masyarakat Sipil Desak Pemerintah dan OPM Gencatan Senjata,2023-04-19 22:30:00
"Kapolri Ingatkan Jajarannya, Jangan sampai Ada Lalu Lintas yang Terhambat Selama Mudik",2023-04-19 22:04:00
"Disebut Genit oleh Nasdem karena Dekati Mahfud, Presiden PKS: Memang Kami Banyak Silaturahmi",2023-04-19 21:16:00
"Bertambah, Prajurit TNI Gugur dalam Upaya Penyelamatan Pilot Susi Air Jadi 4  Orang",2023-04-19 21:08:00
Golkar Akui Bertemu PDI-P Bahas Sistem Pemilu Dua Bulan yang Lalu,2023-04-19 20:28:00
"Bertemu PPP, PKS Klaim Tak Tertarik dengan Koalisi Besar",2023-04-19 20:25:00
"UPDATE 19 April 2023: Kasus Covid-19 Bertambah 1.242 dalam Sehari, Totalnya Jadi 6.760.755",2023-04-19 20:19:00
Puan Berharap Pasar Murah Bisa Atasi Inflasi Bahan Pangan Jelang Lebaran,2023-04-19 20:15:00
"Kakorlantas: Pemudik Boleh Istirahat di ""Exit Toll"", tetapi Tetap Bayar jika Masuk Lagi",2023-04-19 20:10:00
"Gandeng Pihak Ketiga, Kementerian KP Kembangkan Pulau Cemara Jadi Ekowisata Bahari",2023-04-19 20:10:00
PKS Sebut Pertemuan dengan PPP Tak Bahas Sandiaga Uno,2023-04-19 19:44:00
PPP Berharap PKS Punya Pilihan Politik yang Sama,2023-04-19 19:40:00
Menhub Sebut Puncak Mudik Paling Tinggi Hari Ini dan Besok,2023-04-19 19:36:00
MAKI Minta Firli Bahuri dan Jubir KPK Jadi Saksi Kasus Peretasan Ponsel,2023-04-19 19:32:00
"Jokowi Akan Shalat Idul Fitri di Solo, Lebaran Bersama Keluarga",2023-04-19 18:53:00
"Ganjar Terus Teratas di Sejumlah Survei Capres, Hasto Bilang PDI-P Punya Banyak Opsi",2023-04-19 18:49:00
PPP Harap Diberi Kesempatan untuk Kirim Kandidat Capres atau Cawapres di Koalisi Besar,2023-04-19 18:40:00
"Pastikan Arus Mudik Berjalan Lancar, Mbak Ita Pantau SPBU hingga Pasar Bulu",2023-04-19 18:35:00
Jokowi Mudik dan Akan Rayakan Idul Fitri di Solo,2023-04-19 18:26:00
Kapolri Perkirakan Jumlah Pemudik di Stasiun Pasar Senen terus Meningkat hingga H+2 Lebaran,2023-04-19 18:16:00
KPK: Gratifikasi Terkait Jabatan dan Bertentangan dengan Tugas Harus Dilaporkan,2023-04-19 17:53:00
"Cerita Pimpinan Baznas, Penerimaan Zakat Fitrah Naik 300 Persen Awal Pandemi Covid-19",2023-04-19 17:43:00
"3 WNI Ditangkap Polisi Jepang, Kemenlu: Diduga Membunuh dan Membuang Mayat dalam Tas",2023-04-19 17:37:00
PKS Gerilya Cari Cawapres Anies Diduga Akibat Aher Kurang Menjual,2023-04-19 17:36:00
"Kasus Covid-19 Kembali Naik, Jokowi Ingatkan Pentingnya Vaksinasi secara Lengkap",2023-04-19 17:33:00
Kemenag Pastikan 30 Persen Komponen Katering Jemaah Haji Harus Berupa Produk Indonesia,2023-04-19 17:28:00
PKS Dinilai Pertimbangkan 2 Faktor Lirik Sandiaga dan Mahfud MD Jadi Bakal Cawapres Anies,2023-04-19 17:27:00
KPK Masih Dalami Keterlibatan Istri dan 2 Anak Rafael Alun dalam kasus Gratifikasi,2023-04-19 17:19:00
"Getol Jaring Bakal Cawapres Anies, PKS Dinilai Berharap Diuntungkan di Pilpres",2023-04-19 17:18:00
"Pastikan Tak Akan Salah Sasaran, Baznas Gunakan DTKS Kemensos untuk Penyaluran Zakat Fitrah",2023-04-19 17:12:00
Perwira Penggerak Pertamina Belajar Membatik bersama Para Penyandang Disabilitas di Boyolali,2023-04-19 17:10:00
Manuver PKS Cari Cawapres Anies Dinilai Bisa Goyang Soliditas Koalisi Perubahan,2023-04-19 17:06:00
"PDI-P Diyakini Tak Akan Pusing soal Koalisi Besar, Usung Capres Harga Mati",2023-04-19 17:00:00
"Konflik Sudan Masih Memanas, KBRI Khartoum Amankan 15 WNI ke Safe House",2023-04-19 16:58:00
"PPP Sebut Pertemuan dengan PKS Bahas Dinamika Politik, Termasuk soal Sandiaga",2023-04-19 16:57:00
Nasdem: Mahfud Sangat Pantas Jadi Cawapres Anies,2023-04-19 16:54:00
"Ahmad Syaikhu Datangi Markas PPP, Disambut Pelukan Mardiono",2023-04-19 16:51:00
Demokrat Sebut Mahfud MD Punya Semangat Perubahan Beda dengan Sandiaga Uno,2023-04-19 16:47:00
"WNI Kena Peluru Nyasar di Sudan, Kemenlu Pastikan Sudah Sehat",2023-04-19 16:47:00
Kemenlu Pastikan 11 Nelayan WNI yang Terdampar di Australia Bakal Dipulangkan ke RI,2023-04-19 16:41:00
Baznas Targetkan Zakat Fitrah Rp 11 Miliar Disalurkan Sebelum Lebaran Idul Fitri 1444 Hijriah,2023-04-19 16:34:00
"Nasdem Nilai Presiden PKS Genit karena Tawari Mahfud Jadi Cawapres Anies, Curiga Ada Skenario",2023-04-19 16:30:00
"Kapolri, Menhub, hingga Pj Gubernur DKI Cek Pemudik di Stasiun Pasar Senen",2023-04-19 16:30:00
"Canda Hasto Saat Lepas Mudik Gratis, Singgung Koalisi Besar hingga Tempat Kelahiran SBY",2023-04-19 16:25:00
"Akselerasi Transisi Energi Indonesia, PLN Gandeng IEA Matangkan Skema JETP",2023-04-19 16:20:00
Citra Polri Dipertaruhkan Buntut Tak Tertangkapnya Pelaku Utama Kasus Fin888,2023-04-19 16:04:00
"Menang 2 Kali Pemilu dan Punya Elektabilitas Besar, PDI-P Dinilai Wajar Ngotot Usung Capres",2023-04-19 16:00:00
Pengamat: TNI Harus Perhitungkan secara Matang Status Siaga Tempur di Papua,2023-04-19 15:58:00
MAKI Laporkan Peretasan Ponsel Firli Bahuri ke Bareskrim,2023-04-19 15:31:00
PDI-P Beri Sinyal Umumkan Capres Saat Bulan Juni 2023,2023-04-19 15:29:00
"Demokrat Tak Resisten pada Mahfud MD, tapi Minta PKS Tahan Diri",2023-04-19 15:22:00
KPK Sebut Ada Pihak yang Coba Hilangkan Barang Bukti Kasus Suap Wali Kota Bandung,2023-04-19 15:15:00
Geopolitik Indonesia dan Salah Kaprah Doktrin Perang Dunia,2023-04-19 15:13:00
Sekjen PDI-P Sebut Megawati dan Jokowi Selalu Bertemu Bahas Capres-Cawapres,2023-04-19 15:05:00
"Gerilya PKS Cari Bakal Cawapres Anies, Wacanakan Sandiaga hingga Dekati Mahfud MD",2023-04-19 14:37:00
Hasto Sebut Mega Tak Hanya Mencari Sosok Capres dengan Elektoral Tinggi,2023-04-19 14:35:00
Golkar Minta TNI Pikirkan Ulang Keputusan Operasi Siaga Tempur di Papua,2023-04-19 14:28:00
"Kepala BPH Migas dan Menteri ESDM Bertolak ke Banten dan Lampung, Pastikan Stok BBM Aman Jelang Lebaran",2023-04-19 14:23:00
"PKS Tawari Mahfud MD Jadi Cawapres Anies, Demokrat: Jangan Kaya Toko Kelontongan",2023-04-19 14:17:00
"Pantau Keamanan Layanan Gas Bumi di Lamongan, BPH Migas: Gas Bumi Over Suplai",2023-04-19 14:17:00
PSI Sebut Bakal Koalisi Besar Akan Lakukan Gebrakan Pasca-Lebaran,2023-04-19 14:11:00
PDI-P Dukung Panglima Tingkatkan Siaga Tempur di Papua,2023-04-19 14:02:00
KPU Klaim Sudah Hapus Data TNI-Polri Terdaftar Pemilih 2024,2023-04-19 13:56:00
"Kasus Covid-19 Kembali Meningkat, Jokowi Beri 3 Arahan",2023-04-19 13:48:00
"PSI Sebut Airlangga Cocok Maju pada 2024, tapi Tetap Dukung Ganjar",2023-04-19 13:40:00
"Jokowi: Jangan Merasa Aman, Kemudian Tak Melengkapi Vaksinasi Covid-19",2023-04-19 13:38:00
"Jokowi: Penyebaran Covid-19 Mulai Meningkat, tapi Tak Perlu Menyikapinya secara Berlebihan",2023-04-19 13:30:00
PKS Minta Pemerintah Tidak Setengah Hati Selesaikan Masalah KKB Papua,2023-04-19 13:27:00
Prima Gugat Lagi KPU ke Bawaslu karena Tak Lolos Verifikasi Faktual,2023-04-19 13:27:00
"Operasi Siaga Tempur di Papua Dinilai Berisiko Timbulkan Banyak Korban, Berpotensi Langgar HAM",2023-04-19 13:19:00
"Diminta Tak Egois Terkait Wacana Koalisi Besar, PDI-P: Yang Mendominasi Itu Rakyat",2023-04-19 13:15:00
Daftar Terminal dan Maskapainya di Bandara Soekarno-Hatta 2023,2023-04-19 13:11:00
"Tak Hanya Prabowo, Megawati Juga Akan Bertemu Pimpinan Parpol Lain Saat Lebaran",2023-04-19 13:06:00
"Penjelasan Menko PMK soal Masuk Tol Tak Perlu Bayar Lagi Setelah Istirahat di ""Exit Toll""",2023-04-19 13:04:00
Sekjen PDI-P Sebut Megawati Akan Prakarsai Kerja Sama Politik Besar,2023-04-19 12:52:00
Respons Golkar yang Disebut Sudah Gabung Koalisi Gerindra-PKB,2023-04-19 12:45:00
"Hari Ini, ""One Way"" di Km 72 Tol Cipali sampai Km 414 Tol Kalikangkung Diperpanjang hingga Tengah Malam",2023-04-19 12:43:00
"Ditawari PKS Jadi Cawapres Anies, Mahfud: Saya Tak Jawab “Ya” atau “Tidak”",2023-04-19 12:32:00
"Urai Kepadatan, ""Contraflow"" 2 Lajur Diberlakukan di Km 47 sampai Km 70 Tol Jakarta-Cikampek",2023-04-19 12:27:00
PDI-P: Mega dan Prabowo Bakal Bertemu Saat Lebaran,2023-04-19 12:26:00
Pemerintah Sebut Investasi di IKN Didominasi Bidang Energi dan Teknologi,2023-04-19 12:19:00
KPU Nyatakan Prima Tak Penuhi Syarat Verifikasi Ikut Pemilu 2024,2023-04-19 12:16:00
BPH Migas Ingatkan Badan Usaha Pentingnya Keandalan Rantai Pasok BBM dan Komunikasi Publik,2023-04-19 12:14:00
Ketum PP Muhammadiyah: Jadikan Idul Fitri Momentum untuk Memecahkan Masalah Bangsa,2023-04-19 12:10:00
"Amnesty International Desak TNI Hentikan Operasi Siaga Tempur di Papua, Utamakan Dialog",2023-04-19 12:05:00
"Jelang Lebaran, KPK Minta Menteri-Pemda Larang Pakai Fasilitas Dinas untuk Kepentingan Pribadi",2023-04-19 12:04:00
"Mahfud ke Presiden PKS: Jangan Ajak Cawapres dari Luar Parpol, Koalisi Harus Solid",2023-04-19 12:01:00
Komnas HAM Sebut Konflik Agraria Meningkat karena Pembangunan Infrastruktur 8 Tahun Terakhir,2023-04-19 11:30:00
"Ikut Jajaki Koalisi Besar, PSI: Tegak Lurus Sama Pak Jokowi",2023-04-19 11:27:00
"Tingkatkan Keamanan Kargo Operasional Kapal, Pertamina International Shipping Gandeng TNI AL",2023-04-19 11:10:00
Di Balik Langkah Panglima TNI Tingkatkan Status Operasi Lawan KKB Jadi Siaga Tempur...,2023-04-19 11:09:00
"Libur Lebaran, Pelunasan Biaya Haji Berhenti Sementara sampai 26 April",2023-04-19 10:57:00
"Bantah Salah Proses Administrasi Penahanan Lukas Enembe, KPK: Kekeliruan di Pengadilan",2023-04-19 10:38:00
Kapolri Pastikan Akan Kawal Shalat Idul Fitri yang Kemungkinan Jatuh di 2 Tanggal Berbeda,2023-04-19 10:19:00
"Dalam ""Mudik Dinanti, Mudik di Hati Bersama BUMN"", Pertamina Berangkatkan 3.000 Pemudik",2023-04-19 10:19:00
KPK Ingatkan Pegawai Negeri Tak Minta Gratifikasi Lebaran atas Nama Pribadi atau Instansi,2023-04-19 10:02:00
"Sebut ""Rest Area"" Bukan untuk Tidur, Menko PMK: Keluar di ""Exit Toll"" Terdekat, Masuk Tol Lagi Tak Kena Biaya",2023-04-19 09:50:00
"Konflik di Papua Memanas, Pemerintah Didesak Buka Ruang Dialog dengan TPNPB-OPM",2023-04-19 09:36:00
"Cegah Kecelakaan Saat Mudik, Menko PMK: Bawa Pengemudi Cadangan untuk Gantian",2023-04-19 09:27:00
Koalisi Masyarakat Sipil Desak Jokowi Hentikan Operasi Siaga Tempur di Papua,2023-04-19 09:16:00
SSDM Polri Akan Libatkan Densus 88 dan BNPT dalam Rekrutmen Anggota Polisi,2023-04-19 09:03:00
Pemerintah Susun Aturan yang Beri Kepastian soal Percepatan Jenjang Karier Dosen,2023-04-19 08:39:00
Ketika Panglima TNI Tetapkan Status Siaga Tempur dalam Upaya Penyelamatan Pilot Susi Air yang Disandera KKB,2023-04-19 08:22:00
Wamenaker Paparkan 8 Sarana yang Ciptakan Hubungan Industrial Harmonis,2023-04-19 08:00:00
Angkatan Darat Nigeria Tertarik Beli Pesawat CN-235 Buatan Indonesia,2023-04-19 07:43:00
"Diprotes, KPU Sebut Akan Serahkan Salinan DPS Pemilu 2024 ke Bawaslu",2023-04-19 07:34:00
"Benarkan Bertemu Presiden PKS, Mahfud: Terkait Cawapres Hanya Pembicaraan Sekilas",2023-04-19 07:25:00
Firli Bahuri Temui Kapolri di Tengah Polemik Pencopotan Endar Priantoro dan Isu Kebocoran Penyelidikan,2023-04-19 07:08:00
KPU Buka Suara Usai Dituding Perlakukan Prima Tak Adil dalam Verifikasi Faktual,2023-04-19 06:50:00
KPK Minta Hakim Tolak Permohonan Pemindahan Penahanan Lukas Enembe,2023-04-19 06:33:00
"Komnas HAM: Konflik Agraria Meningkat, Pihak Teradu Paling Banyak dari Korporasi dan Pemerintah",2023-04-19 06:23:00
"Ungkap Tantangan Pembentukan Koalisi Besar, PAN: Agak Sulit Tentukan Capres-Cawapres",2023-04-19 06:14:00
Komnas HAM Desak TPNPB-OPM Bebaskan Pilot Susi Air,2023-04-19 06:07:00
"Lepas Ribuan Pemudik Gratis di Stasiun Pasar Senen, Sekjen PDI-P Klaim Bentuk Tanggung Jawab Partai",2023-04-19 05:56:00
KPK Tegaskan Penetapan Tersangka Lukas Enembe Sudah Sesuai Hukum,2023-04-19 05:47:00
"Hasto Sebut Megawati Kerap Bertemu Kepala Daerah PDI-P secara ""Online"", Salah Satunya Ganjar",2023-04-19 05:39:00
Koalisi Masyarakat Sipil Desak TNI Batalkan Operasi Siaga Tempur di Papua,2023-04-19 05:30:00
"Di Hadapan Jokowi, PM Ceko Sebut ASEAN Punya Nilai Sama dengan Uni Eropa",2023-04-19 05:27:00
[POPULER NASIONAL] Kabar Terbaru Penyelamatan Pilot Susi Air | KPK Diminta Periksa Pemprov Lampung,2023-04-19 05:03:00
Tanggal 21 April Hari Memperingati Apa?,2023-04-19 00:00:00
"Pengaduan Konflik Agraria Meningkat, Komnas HAM Bentuk Tim Agraria",2023-04-18 23:18:00
KPK: Ada yang Catut Nama Jubir Ali Fikri untuk Minta Bertemu Bupati Nias,2023-04-18 23:00:00
"Presiden PKS Fokus Cari Cawapres Anies, Keliling Datangi Tokoh yang Masuk Survei",2023-04-18 22:47:00
"TNI Siaga Tempur di Papua, Komnas HAM Ingatkan soal Prinsip Kehati-hatian",2023-04-18 22:35:00
Hasto: Bandul Politik Akan Bergerak Setelah Ditetapkan Capres dari PDI-P,2023-04-18 22:12:00
RI Siap Ekspor Pangan Hewani untuk Katering Jemaah Haji Indonesia,2023-04-18 21:54:00
BRGM bersama Tim P5 Susun Sarana Edukasi tentang Ekosistem Gambut untuk Murid SMA/SMK,2023-04-18 21:29:00
"Merasa Diperlakukan Tak Adil, Prima Siap Ajukan Kasasi Terkait Penundaan Pemilu",2023-04-18 21:08:00
"Buka 48 Posko Mudik Lebaran, PKS: Ini Bukan Pencitraan",2023-04-18 20:49:00
Hasto Sebut Liga Bola Kampung Jadi Bahan Pembicaraan Megawati dan Ganjar,2023-04-18 20:39:00
Sekjen PDI-P: Setelah Lebaran Itu Momentum yang Baik untuk Penjajakan Kerja Sama Politik,2023-04-18 20:30:00
Prima Anggap Ada Ketidakadilan di Verifikasi Faktual KPU,2023-04-18 20:28:00
"Kemenkes Ingatkan Covid-19 Masih Ada, Berpotensi Naik karena Varian Baru",2023-04-18 20:15:00
PM Ceko: Kami Tertarik Memodernisasi Militer Indonesia,2023-04-18 20:08:00
"Sekjen PDI-P Sebut Megawati Tak Gelar ""Open House"" Lebaran Tahun Ini",2023-04-18 20:07:00
"Buntut Kasus TikToker Bima di Lampung, Mahfud Pesan ke Pejabat dan ASN agar Tidak Seenaknya",2023-04-18 19:59:00
"Bertemu PM Ceko, Jokowi Cerita Indonesia Akan Libur Satu Minggu dalam Rangka Idul Fitri",2023-04-18 19:48:00
"Tertarik dengan Proyek IKN, Perusahaan dari Ceko Tawarkan Teknologi Hijau",2023-04-18 19:40:00
"Update 18 April 2023: Kasus Covid-19 Bertambah 1.343 dalam Sehari, Totalnya Jadi 6.759.153",2023-04-18 19:25:00
Menaker Ida Lepas Keberangkatan 78 Bus dan 3 Kereta untuk Mudik Pekerja,2023-04-18 19:24:00
"Terima PM Petr Fiala di Bogor, Jokowi: Kunjungan Pertama Kepala Pemerintah Ceko ke Indonesia",2023-04-18 19:21:00
Kapolri Sebut Peningkatan Kendaraan di GT Kalikangung Capai 300 Persen,2023-04-18 19:15:00
Jokowi Ajak Republik Ceko Berinvestasi di Proyek IKN,2023-04-18 19:10:00
"Soal Wacana Koalisi Besar, Sekjen PDI-P: Pada Akhirnya Ditentukan Figur yang Bakal Ditetapkan",2023-04-18 19:06:00
"Kemenkes: Kasus Covid-19 Naik, tapi Masih di Bawah Standar WHO",2023-04-18 18:51:00
Panglima Sebut 4 Prajurit yang Luka Saat Operasi Pembebasan Pilot Susi Air dalam Kondisi Sehat,2023-04-18 18:49:00
"Pamer Pernah Hampir Menang Lawan Koalisi Besar, PKS: Sekarang Harus Hampir Kalah",2023-04-18 18:39:00
"Geledah Kantor Balai Teknik Perkeretaapian Jateng, KPK Amankan Uang-Logam Mulia Puluhan Miliar",2023-04-18 18:33:00
"Syaikhu: Mungkin Saja Sandiaga Uno Gabung PKS, ""Ahlan Wa Sahlan""",2023-04-18 18:28:00
"Geledah Balai Kota Bandung, KPK Amankan Dokumen Terkait Perkara Suap Yana Mulyana",2023-04-18 18:27:00
PM Ceko Sebut IKN Proyek yang Ambisius,2023-04-18 18:24:00
Cak Imin Sebut 5 Parpol dari KKIR dan KIB Sempat Bertemu Matangkan Koalisi Besar,2023-04-18 18:19:00
"Hasto Ungkap PDI-P Bertemu Golkar-Gerindra, Bahas Persoalan Sistem Pemilu",2023-04-18 18:10:00
"Presiden PKS Datangi Mahfud, Tawari Jadi Cawapres Anies",2023-04-18 17:59:00
Megawati Dijadwalkan Gelar Silaturahim Politik Saat Lebaran,2023-04-18 17:56:00
"KKB Serang Prajurit TNI, Panglima: Kalau Dibalas Operasi Humanis, Ya Habis Kita",2023-04-18 17:54:00
Panglima TNI: Pernyataan KST yang Sering Muncul di YouTube Hoaks Semua,2023-04-18 17:47:00
KTT ASEAN 2023 Diharap Bakal Mengulang Kesuksesan KTT G20,2023-04-18 17:43:00
Panglima Sebut TNI Siaga Tempur di Daerah Rawan di Papua,2023-04-18 17:41:00
"Bertemu Jokowi, PM Ceko Sebut Indonesia Partner Penting untuk Negaranya",2023-04-18 17:30:00
"Alasan Operasi Lawan KKB Dinaikkan Jadi Siaga Tempur: Upayakan Damai, Malah Diserang",2023-04-18 17:21:00
Jokowi Ajak PM Republik Ceko Tanam Pohon Kamper di Istana Bogor,2023-04-18 17:20:00
"Komunikasi dengan Pejabat ESDM, Wakil Ketua KPK Johanis Tanak Siap Hadapi ICW",2023-04-18 16:56:00
Jokowi Terima Kunjungan PM Republik Ceko di Istana Bogor,2023-04-18 16:50:00
KPK Minta Hakim Tolak Seluruh Permohonan Lukas Enembe di Sidang Gugatan Praperadilan,2023-04-18 16:50:00
"Lebaran 2023 Bisa Kembali Berbeda, Begini Keputusan Pemerintah dan Muhammadiyah",2023-04-18 16:50:00
Menteri PPPA Dorong Hukuman Maksimal bagi Pelaku Pelecehan Seksual di Ponpes Batang,2023-04-18 16:42:00
"Prajurit Kostrad Gugur Diserang KKB, Panglima TNI: Tidak Ada Penambahan Pasukan di Papua",2023-04-18 16:37:00
Cak Imin Klaim Golkar Akan Gabung Koalisi Bareng PKB-Gerindra,2023-04-18 16:31:00
Bawaslu Protes Tak Dapat Salinan DPS Pemilu 2024,2023-04-18 16:27:00
Panglima TNI Tingkatkan Status Operasi Pembebasan Pilot Susi Air Jadi Siaga Tempur,2023-04-18 16:26:00
"Lepas 30 Bus Pemudik, Cak Imin Minta Didoakan Menang Jadi Presiden RI",2023-04-18 16:20:00
Demokrat: Dukungan Banyak Parpol Belum Tentu Paralel dengan Jumlah Suara,2023-04-18 16:16:00
Penjelasan Ketua KPU Terkait Banyak Pemilih Dinyatakan Tidak Memenuhi Syarat,2023-04-18 16:16:00
ICW Laporkan Johanis Tanak ke Dewas KPK,2023-04-18 16:12:00
"Minta Penetapan Lebaran Tak Dipersoalkan, Mahfud MD: Sama-sama 1 Syawal",2023-04-18 16:09:00
"Tanggapi PDI-P, PAN: Pengumuman Paslon dari Parpol atau Koalisi Akan Saling Berpengaruh",2023-04-18 16:08:00
Pengamat Nilai Wajar PDI-P Patok Nilai Tinggi untuk Gabung Koalisi Besar,2023-04-18 16:02:00
Memanfaatkan Tradisi Mudik Mendorong Perubahan Sosial,2023-04-18 16:00:00
Bawaslu Temukan Masalah DPS Pemilu 2024 Terkait TPS Khusus dan Pemilih Disabilitas,2023-04-18 15:54:00
Pemilih Belum Punya KTP Tak Bisa Mencoblos pada Pemilu 2024? KPU Sebut Bisa Gunakan NIK di KK,2023-04-18 15:49:00
"Hindari Mobilisasi dari Kiai, TPS Khusus Santri Akan Dibangun di Luar Pesantren",2023-04-18 15:49:00
"Mahfud Sebut Proses Legislasi Koruptif, Anggota DPR: Jangan Hanya Ceramah, Buka Saja",2023-04-18 15:39:00
"Tak Temui Kendala, Partai Ummat Klaim Ideologinya Justru Permudah Rekrut Caleg",2023-04-18 15:38:00
Eks Buron KPK Ricky Ham Pagawak Diduga Beli Tanah di Desa Pakai Nama Orang Lain,2023-04-18 15:27:00
"PDI-P Yakin Konsolidasi Koalisi Besar Tunggu Pengumuman Capres, Golkar: ""Chemistry"" Sudah Cocok",2023-04-18 15:10:00
"Soal M Adil Gadai Kantor Bupati Meranti, Yasonna: Enggak Bisa Seenak Udel!",2023-04-18 15:07:00
Kapolri Sebut yang Ikut Mudik Polri Presisi 2023 Bisa Daftar Arus Balik,2023-04-18 15:07:00
Mahfud: Surpres RUU Perampasan Aset Akan Dikirim Sesudah Lebaran,2023-04-18 15:03:00
"Ada 7 Kasus Covid-19 Subvarian Omicron Arcturus di Indonesia, Ini Rinciannya",2023-04-18 14:59:00
"KPK Sita Mobil dan ""Homestay"" Ricky Ham Pagawak, Nilainya Rp 10 M Lebih",2023-04-18 14:52:00
"Potensi Beda Hari Lebaran, Sekum PP Muhammadiyah Imbau Warga Tunda ""Open House""",2023-04-18 14:43:00
Satwa Langka Bukan Barang Ekonomi,2023-04-18 14:30:00
Mahfud: Perbedaan Hari Raya Idul Fitri Jangan Sampai Timbulkan Perpecahan,2023-04-18 14:29:00
Mahfud: Polemik Shalat Idul Fitri Muhammadiyah di Sukabumi-Pekalongan Hanya Salah Persepsi,2023-04-18 14:28:00
"RUU Perampasan Aset Telah Selesai, Wamenkumham: Dalam Waktu Dekat Kita Kirim ke DPR",2023-04-18 14:20:00
"Hari Ini, ""One Way"" Dimulai Pukul 14.30 WIB di Km 72 Tol Cipali hingga Km 414 Kalikangkung",2023-04-18 14:08:00
"KPU Siapkan TPS Khusus untuk Santri, Tahanan, hingga Mahasiswa Rantau",2023-04-18 13:47:00
Nasdem Sebut KPP Siap Hadapi Koalisi Besar yang Masih di Awang-awang,2023-04-18 13:44:00
"Tiktoker Bima Yudho Dipolisikan, Dirjen HAM: Kritik Bagian dari Kebebasan Berpendapat",2023-04-18 13:37:00
Kapolri Perkirakan Peningkatan Kendaraan Pemudik Terjadi Malam Hari Ini,2023-04-18 13:19:00
"Bantah KPP Koalisi Kecil Usai Wacana Koalisi Besar, Nasdem: Jangan Terjebak Terminologi",2023-04-18 13:10:00
"Jokowi Wanti-wanti Masyarakat Segera Vaksin “Booster”, Berapa Capaian Vaksinasi Covid-19 di Indonesia?",2023-04-18 12:59:00
Integrasi Pipa KJG dan Gresem Berikan Jaminan Perluasan Manfaat Gas Bumi di Jateng,2023-04-18 12:58:00
"Surati Pimpinan Parpol Peserta Pemilu 2024, KPU Minta DPS Dicermati",2023-04-18 12:57:00
KPU Coret Pembentukan PPLN Korea Utara dan Afghanistan karena Alasan Keamanan,2023-04-18 12:48:00
"Buka Rapat Rekapitulasi DPS Pemilu 2024, Ketua KPU Semangati Para Pantarlih",2023-04-18 12:38:00
"KPU: Jumlah Daftar Pemilih Sementara Pemilu 2024 Capai 205 Juta Orang, Masih Bisa Berubah",2023-04-18 12:24:00
"Lepas Bus Mudik Bareng Kemenkumham, Yasonna Ingatkan Pegawai Tak Melalaikan Kinerja",2023-04-18 12:17:00
"Kapolri Lepas 23.439 Pemudik Gratis, Ingatkan Pengemudi Hati-hati di Jalan",2023-04-18 12:11:00
KPU Larang TPS Didirikan di Asrama TNI dan Polri karena Khawatirkan Hal Ini,2023-04-18 12:02:00
"Aliran Dana Dugaan Korupsi Pengadaan Tanah di Pulo Gebang Pakai Kode ""THR""",2023-04-18 11:55:00
"Soal Penggunaan Lapangan untuk Shalat Idul Fitri, Menag Imbau Pemda Beri Izin",2023-04-18 11:45:00
Dewas KPK Periksa Karo Hukum dan Karo SDM Terkait Pemberhentian Endar Priantoro,2023-04-18 11:29:00
KPK Tetapkan 2 Tersangka Baru Penyuap Lukas Enembe,2023-04-18 11:22:00
