Article,Date
Posisi Strategis Sandiaga di PPP Diumumkan Setelah Rapimnas,2023-06-12 10:46:00
Rencana Pertemuan Puan-AHY serta Jejak Rivalitas PDI-P dan Demokrat,2023-06-12 10:43:00
"Kemenag: Layanan Katering untuk Jemaah Haji di Mekkah Berhenti Sementara pada 7, 14, dan 15 Zulhijjah",2023-06-12 10:38:00
Sinyal PPP Usung Sandiaga Uno Jadi Cawapres Pilpres 2024...,2023-06-12 10:23:00
MA Tolak Gugatan PSI Terkait Aturan Pendirian Rumah Ibadah,2023-06-12 09:56:00
"KPK Sebut Lukas Enembe Akan Jalani Sidang Secara ""Online"" Hari Ini",2023-06-12 09:32:00
Blak-blakan Mahfud MD Bicara Transaksi Balik Meja DPR dan Penyusup di Penegak Hukum,2023-06-12 09:21:00
Eksaminasi Akademisi Atas Putusan Sambo: Pasal Pembunuhan Berencana Dinilai Kurang Tepat Digunakan,2023-06-12 09:19:00
"Hari Ini, Sidang Perdana Praperadilan Sekretaris Nonaktif MA Hasbi Hasan Digelar",2023-06-12 08:41:00
Menpan-RB: ASN dari 40 Kementerian Siap Pindah ke IKN pada 2024,2023-06-12 08:35:00
"Sidang Praperadilan Keponakan Wamenkumham, PN Jaksel Kembali Panggil Dirtipidsiber Bareskrim",2023-06-12 08:29:00
"[GELITIK NASIONAL] Kemelut Koalisi Perubahan soal Cawapres Anies, PDI-P dan Demokrat Saling Lirik",2023-06-12 08:29:00
Mahfud Beri Peringatan soal Penyusup di Lembaga Penegak Hukum,2023-06-12 08:28:00
"Rencana Pertemuan Puan-AHY, Upaya Rekonsiliasi PDI-P dan Demokrat Usai 20 Tahun Jalin Relasi Konflik?",2023-06-12 08:21:00
Haji sebagai Ziarah Individu dan Urusan Negara,2023-06-12 07:30:00
Tatkala Bung Karno Dimakamkan,2023-06-12 07:15:00
Komnas HAM Disebut Rekomendasikan Lukas Enembe untuk Dirawat di Rumah Sakit,2023-06-12 07:03:00
"Hari Ini, Lukas Enembe Akan Jalani Sidang Perdana di Pengadilan Tipikor",2023-06-12 06:42:00
"Demokrat yang Dulu Ditolak ""Banteng"", tapi Kini Didekati",2023-06-12 06:35:00
[POPULER NASIONAL] Jokowi dan SBY Olahraga di Senayan | Mahfud Sebut Banyak Penyusup di Lembaga Pemerintahan,2023-06-12 06:24:00
Iklan Sampah Politisi,2023-06-12 06:00:00
"Anies Baswedan, Hasil Survei, dan Problem Komunikator",2023-06-12 05:45:00
"Peluang Kaesang Maju di Pilwalkot Depok, Mampukah Tumbangkan ""Rezim"" PKS?",2023-06-12 05:30:00
Sekjen PDI-P dan Demokrat Bahas Rencana Pertemuan Puan-AHY,2023-06-12 05:25:00
Tanggal 14 Juni Memperingati Hari Apa?,2023-06-12 00:00:00
"Ungkap Alasan Turunnya Indeks Persepsi Korupsi, Mahfud: Di DPR Terjadi Transaksi Balik Meja",2023-06-11 21:59:00
"Sidang Perdana, Pihak Lukas Enembe Minta Hadir Langsung di PN Tipikor",2023-06-11 21:08:00
Membebaskan Fakir Miskin dari Kemiskinan adalah Panggilan Moral Agama,2023-06-11 20:50:00
Menaker Pimpin Delegasi Indonesia pada Konferensi Perburuhan Internasional ke-111 di Swiss,2023-06-11 20:07:00
"6 Pesawat Tempur F-16 Milik Angkatan Udara AS Mendarat di Pekanbaru, Akan Latihan Bareng TNI AU",2023-06-11 20:01:00
Hary Tanoesoedibjo Lantik Arnod Sihite sebagai Ketua Umum DPN Basperindo,2023-06-11 19:17:00
Mahfud MD: Di Lembaga Pemerintahan Sekarang Banyak Penyusup,2023-06-11 18:33:00
"Dukung Ganjar Pranowo Jadi Capres, Hary Tanoe Ingin Elektabilitas Perindo Cepat Naik",2023-06-11 18:24:00
Ribuan Pohon Ararea Ditanam di Depan Kedubes AS,2023-06-11 18:21:00
Tips Sa’i Aman bagi Jemaah Haji Lansia dan Berisiko Tinggi,2023-06-11 16:59:00
"Jemaah Haji Tak Dapat Makanan 3 Hari di Makkah, Catat Waktunya",2023-06-11 16:29:00
Ganjar Janji Rawat Jiwa Nusantara di Hadapan Ratusan Ribu Relawan Se-Indonesia,2023-06-11 16:12:00
"""Delay"" Pesawat Berimbas pada Pemindahan Hotel Jemaah Haji di Madinah",2023-06-11 16:00:00
Menko Polhukam Jamin Pemilu Tepat Waktu,2023-06-11 15:49:00
"KPU Siapkan TPS dan Surat Suara Khusus Pemilu 2024 untuk Orang Sakit, Pelajar, hingga Warga Binaan",2023-06-11 15:46:00
Mahfud MD Persilakan Jusuf Hamka Tagih Utang ke Kemenkeu: Nanti Saya Bantu...,2023-06-11 15:36:00
"Putusan Mati Ferdy Sambo-Putri Candrawathi Dieksaminasi 8 Akademisi, Salah Satunya Wamenkumham",2023-06-11 14:53:00
"Kaesang Jadi ""Depok Pertama"", Jubir: PKS Siap Berkompetisi secara Sehat",2023-06-11 14:11:00
"Komnas HAM Deklarasikan Pemilu Ramah HAM, Lindungi Hak Kelompok Marginal dan Rentan",2023-06-11 13:58:00
PPP Tidak Keberatan PDI-P yang Rangkul Partai Demokrat,2023-06-11 13:35:00
Pengamat Nilai Ada Dua Hal yang Membuat PDI-P Buka Peluang Kerja Sama dengan Demokrat,2023-06-11 13:11:00
PPP Akan Gelar Rapimnas Bahas Peluang Sandiaga Diusulkan Jadi Cawapres Ganjar,2023-06-11 13:00:00
"Kaesang Siap Jadi ""Depok Pertama"", PKS: ""Welcome to The Jungle""",2023-06-11 12:22:00
"Jokowi dan SBY Dikabarkan Berada di GBK Pagi Ini, Demokrat: Sama-sama Sedang Olahraga",2023-06-11 12:13:00
PPP Akan Resmikan Sandiaga Uno Jadi Kader pada Rabu Pekan Ini,2023-06-11 12:00:00
"Resmi, NTB Jadi Tuan Rumah Gelar TTG Nusantara 2024",2023-06-11 10:39:00
"PDI-P Ajak Demokrat Kerja Sama Politik, Pengamat: Momentum Rekonsoliasi",2023-06-11 10:29:00
Demokrat Sambut Baik Rencana Pertemuan Puan-AHY,2023-06-11 09:36:00
Provinsi Lampung Berhasil Jadi Juara Umum Gelar TTG Nusantara XXIV,2023-06-11 09:21:00
Demokrat Terbuka atas Tawaran Kerja Sama PDI-P,2023-06-11 08:40:00
Warga Gang Mayong Cerita Keengganan Pindah Rumah meski Sering Terjadi Tawuran,2023-06-11 08:33:00
Ketika Partai Golkar Tak Ingin Buru-Buru Tentukan Capres-Cawapres 2024...,2023-06-11 07:17:00
Upaya PDI-P Dekati Demokrat di Tengah Desakan agar Anies Baswedan Umumkan Bakal Cawapres...,2023-06-11 06:13:00
"Cerita Pahit Masa Kecil Ganjar, Orangtua Harus Utang dari Bulan ke Bulan",2023-06-11 05:11:00
Tanggal 13 Juni Memperingati Hari Apa?,2023-06-11 00:00:00
Ganjar Merinding Tahu Putri Ariani Dapat Golden Buzzer di America's Got Talent,2023-06-10 23:15:00
"Indonesia Resmi Bebas Masker, Masyarakat Tetap Diminta Booster Vaksin Covid-19",2023-06-10 22:57:00
"Ganjar Sebut Jokowi Kalah di Beberapa Tempat Gara-gara ""Stempel PKI""",2023-06-10 22:44:00
PDI-P Atur Pertemuan Tertutup Megawati dengan Cak Imin-Airlangga Hartarto,2023-06-10 22:36:00
"Deret Jenderal TNI-Polri Pendukung Ganjar, Ada Mantan KSAL Sampai KSAU",2023-06-10 21:24:00
"Sejumlah Purnawirawan Dukung Ganjar, Anggap Bisa Lanjutkan Program Jokowi",2023-06-10 21:02:00
"Jemaah Punya Keluhan soal Haji, Kontak 'Lapor Gus Men'",2023-06-10 20:44:00
Golkar Mengaku Belum Diundang PDI-P untuk Bahas Rencana Dukung Ganjar,2023-06-10 20:32:00
"Kritik Kebijakan Jokowi soal Mobil Listrik, Anies: Jangan Sampai Subsidi Kepada yang Tidak Perlu",2023-06-10 20:13:00
Aburizal Bakrie Nilai Golkar Tak Perlu Buru-buru Putuskan Arah Koalisi,2023-06-10 19:16:00
Menaker Ida: SDM Indonesia Harus Punya Karakter Pancasila,2023-06-10 18:58:00
"Pameran GTTGN 2023 Cetak Transaksi Rp 2,1 Miliar dalam 4 Hari",2023-06-10 18:30:00
Ganjar Sebut Ada Parpol Lain yang Bakal Mendukungnya Setelah Perindo,2023-06-10 18:11:00
"Megawati: Saya Ingin Pensiun, tetapi Enggak Dikasih Sama Pak Jokowi",2023-06-10 17:55:00
PDI-P Bantah Dukungan Jokowi ke Ganjar Bercabang ke Prabowo: Framing untuk Memecah Belah,2023-06-10 17:36:00
"PDI-P ""Rangkul"" Demokrat, Hasto: Toh Lamaran Anies Belum Turun",2023-06-10 17:26:00
"Gerindra Minta Kader Tidak Grusa-grusu, Jangan Jadi Beban Pemenangan Prabowo",2023-06-10 16:58:00
"Demokrat Desak Cawapres Ditetapkan, Anies Jawab Singkat",2023-06-10 16:53:00
Ganjar Akui Ia Diajak Bicara Terakhir soal Sosok Cawapres,2023-06-10 16:47:00
"Puan Akan Temui AHY, Hasto: PDI-P Merangkul, Sambil Demokrat Tunggu Lamaran Anies",2023-06-10 16:39:00
PDI-P Tawarkan Kaesang Ikut Sekolah Partai Seperti Gibran,2023-06-10 16:39:00
Anies Tinggal Tunggu Hari Baik untuk Umumkan Cawapres,2023-06-10 16:31:00
Danny Pomanto Instruksikan Kontainer Jadi Posko Program Jagai Anakta,2023-06-10 15:55:00
"Kaesang Siap Maju Jadi Calon Wali Kota Depok, Gerindra: Kabar Gembira",2023-06-10 15:46:00
Aturan Lengkap Syarat Perjalanan dan Protokol Kesehatan di Ruang Publik Terbaru,2023-06-10 15:30:00
Megawati Ungkap Percakapan 6 Ketua Umum Partai Parpol dengan Jokowi Awal Mei,2023-06-10 15:16:00
"Megawati: Saya Dijuluki Perempuan Terkuat di Dunia, Contoh Saya Saja...",2023-06-10 15:07:00
Syarat Perjalanan Terbaru: Masker Tak Wajib bagi Orang yang Sehat,2023-06-10 14:17:00
Anggaran Memadai Dorong Pembangunan di Kota Medan Berjalan Masif,2023-06-10 14:12:00
"PDI-P Dekati PKB, Gerindra: Prabowo dan Muhaimin Saling Percaya",2023-06-10 13:45:00
"Deretan Partai yang Dukung Ganjar Capres 2024, Siapa Saja?",2023-06-10 13:01:00
Megawati Resmikan RS Terapung Laksamana Malahayati,2023-06-10 13:00:00
Prabowo Disebut Senyum-senyum Usai Dipanggil Jokowi ke Istana,2023-06-10 12:47:00
Ganjar Sebut Ada Peluang Cawapres Berlatar Belakang Militer,2023-06-10 12:46:00
"16 Nama yang Terlibat Kasus Transaksi Janggal Kemenkeu, Ada yang Nilainya Tembus Rp 3 Triliun",2023-06-10 12:24:00
Saat Ganjar Tirukan Ekspresi Melongo Jokowi di Hadapan Relawannya...,2023-06-10 12:15:00
Menaker Ida Tegaskan Kekerasan Seksual di Tempat Kerja Tak Bisa Ditoleransi,2023-06-10 12:09:00
Menimbang Proposal Prabowo untuk Perdamaian Rusia-Ukraina,2023-06-10 12:04:00
Sekjen Gerindra: Kami Tidak Sabar Ingin Pak Prabowo Jadi Presiden,2023-06-10 12:03:00
Jasa Raharja dan AHM Kembangkan Program Keselamatan Berkendara bagi Pesepeda Motor,2023-06-10 11:49:00
"Ganjar Puji Jokowi: Dihina ""Plonga-plongo"", tapi Berhasil Ambil Alih Freeport",2023-06-10 11:32:00
Mantan Sekjen Kemenhan Era Prabowo Pimpin Tim Relawan Ganjar,2023-06-10 11:19:00
Sudirman Said Sebut Demokrat Tak Paksakan AHY Jadi Cawapres Anies,2023-06-10 11:10:00
Relasi Negara dan Umat: Refleksi Haji,2023-06-10 09:55:00
Provinsi Lampung Juarai Lomba Cepat Tepat Nusantara Inisiatif Kemendesa PDTT,2023-06-10 09:45:00
"Akal-akalan Andhi Pramono Sembunyikan Harta Berlimpah: Manfaatkan Mertua, Tutupi Transaksi Rp 60 M",2023-06-10 09:33:00
"Tak Sempat Olahraga, Ganjar Langsung Temui Relawan di Jakut",2023-06-10 09:20:00
Gaduh soal Cawapres Anies dan Godaan Demokrat-PKS Hengkang dari Koalisi Perubahan,2023-06-10 09:02:00
Sekjen Gerindra Sebut Prabowo Usulkan Perdamaian Ukraina-Rusia karena Produksi Pupuk Dalam Negeri Mulai Menipis,2023-06-10 08:52:00
"Firli dkk Menjabat hingga 2023, Pemerintah Ikut Putusan MK",2023-06-10 08:13:00
Sentilan Tajam Nasdem ke Demokrat soal Cawapres Anies: Singgung Potensi Mundur hingga Minim Baliho,2023-06-10 06:30:00
[POPULER NASIONAL] Hary Tanoe Akhirnya Dukung Ganjar Capres | Nasdem dan Demokrat Memanas,2023-06-10 05:30:00
MAKI Bakal Kembali Ajukan Uji Materi soal Masa Jabatan Pimpinan KPK,2023-06-10 05:24:00
Mahfud Ungkap 2 Alasan yang Buat Pemerintah Perpanjang Masa Jabatan Firli dkk di KPK,2023-06-10 05:08:00
Jatam Curigai Reaksi Panik Pemkot Jambi Laporkan Siswi SMP yang Kritis,2023-06-10 04:21:00
"Muhammadiyah dan KWI Bertemu, Bahas Peran Agama dalam Bernegara",2023-06-10 04:09:00
"Jawab Tudingan Nasdem, Demokrat Klaim Tak Paksakan AHY Jadi Cawapres Anies",2023-06-10 00:24:00
"Soal Proposal Ukraina-Rusia, Istana: Presiden Tentu Tanya ke Menhan",2023-06-10 00:00:00
Tanggal 12 Juni Memperingati Hari Apa,2023-06-10 00:00:00
Klaim Firli soal 16 Pelaku Pencucian Uang Diusut KPK Disebut Pencitraan dan Tak Sesuai Realita,2023-06-09 23:41:00
Wapres Minta Jokowi Beri Insentif agar Investor Mau Masuk ke Kawasan Industri Halal,2023-06-09 23:15:00
"Keppres Perpanjangan Masa Jabatan Firli dkk Segera Terbit, KPK: Mari Tutup Perdebatan",2023-06-09 23:03:00
Jemaah Haji Sakit Mulai Dievakuasi ke Mekkah dari Madinah Hari Ini,2023-06-09 22:45:00
"Tim Reformasi Percepatan Hukum Dikritik, Mahfud: Enggak Perlu Dikomentari kalau Pak Amien Rais",2023-06-09 22:41:00
Bareskrim Musnahkan 75 Kg Sabu dan 50.000 Ekstasi Barbuk 7 Kasus Narkotika,2023-06-09 22:39:00
"Demokrat-Nasdem Memanas soal Deklarasi Cawapres, PKS: Enggak Ada Paksa Memaksa",2023-06-09 22:17:00
"Hasto Sebut Parpol Hijau Bakal Bergabung, PKB ""Ngaku"" Masih Bersama Gerindra",2023-06-09 20:53:00
"Update 9 Juni 2023: Kasus Covid-19 Bertambah 190 dalam Sehari, Total Jadi 6.809.821",2023-06-09 20:24:00
Mahfud: Kerja Tim Percepatan Reformasi Hukum sampai 31 Desember 2023,2023-06-09 20:13:00
"Mafia Gerogoti Lembaga Peradilan hingga Agraria, Alasan Mahfud Buat Tim Reformasi Hukum",2023-06-09 19:56:00
Mahfud: Hasil Kerja Tim Percepatan Reformasi Hukum Akan Diserahkan ke Presiden,2023-06-09 19:55:00
"Prabowo Temui Jokowi Jumat Sore, Istana: Menhan Dipanggil Pak Presiden",2023-06-09 19:25:00
"Patuhi Putusan MK, Mahfud: Sekali Tak Ikuti, Nanti Berikutnya Pemerintah Juga Membangkang",2023-06-09 19:09:00
Bareskrim Tangkap Satu Buron Kasus Bandar Pabrik Ekstasi di Tangerang,2023-06-09 19:09:00
Arab Saudi Respons Protes Kemenag soal Penerbangan Haji Saudia Airlines,2023-06-09 19:06:00
"Gelombang II Jemaah Haji Tiba di Makkah, Pasokan Air Bersih Dipantau",2023-06-09 19:06:00
Mahfud Akui Pemerintah Kurang Sependapat dengan MK soal Masa Jabatan Pimpinan KPK,2023-06-09 18:46:00
Rijatono Lakka Tegaskan Uang Rp 1 Miliar yang Dianggap Suap adalah Milik Lukas Enembe,2023-06-09 18:37:00
Bawaslu Siapkan Mitigasi Pengawasan Surat dan Kotak Suara Pemilu 2024,2023-06-09 18:29:00
"Hadapi 2024, Banggar DPR Minta Kementerian Koordinator Konsolidasi Jalankan 8 Kebijakan Jokowi",2023-06-09 18:27:00
KPU: Pengelolaan Beberapa Logistik Pemilu 2024 Diserahkan ke Daerah,2023-06-09 17:58:00
AHY-Demokrat Dinilai Bisa Merapat ke Golkar Jika Gagal Dampingi Anies,2023-06-09 17:57:00
Peluang AHY Jadi Cawapres Dinilai Besar dan Tak Harus Bersama Anies,2023-06-09 17:57:00
"Demokrat Resah, Sinyal Belum Dulang Keuntungan dari Dukung Anies?",2023-06-09 17:57:00
Elektabilitas Anies Diprediksi Sulit Naik Jika Tetap Kontra Jokowi,2023-06-09 17:56:00
"Ciri-ciri Partai yang Diharapkan Ikut Dukung Ganjar Versi PDI-P, Warna Hijau dan Keemasan",2023-06-09 17:52:00
Ketua Komisi VII DPR RI Dilaporkan ke MKD Atas Dugaan Pelecehan Seksual Verbal,2023-06-09 17:46:00
"Pesan KSAD Dudung kepada Prajurit yang Akan ke Papua, Halau Senjata dan Narkoba",2023-06-09 17:44:00
Satgas TPPO Gagalkan Pemberangkatan 123 PMI Ilegal ke Malaysia,2023-06-09 17:38:00
Polri: Rumah Anggota Polisi yang Diduga Jadi Penampungan Korban TPPO di Lampung Disewakan ke Tersangka,2023-06-09 17:15:00
Polri: Rumah Anggota Polisi yang Diduga Jadi Penampungan Korban TPPO di Lampung Disewakan ke Tersangka,2023-06-09 17:15:00
Prabowo Temui Presiden Jokowi di Istana,2023-06-09 17:08:00
"PDI-P: Dengan Kerendahan Hati, Kami Tawarkan Demokrat Kerja Sama",2023-06-09 17:02:00
"Tanggapi Video Viral, Kemenag: Jemaah Kloter 14 Makassar Tidak Telantar, tapi Pindah Hotel",2023-06-09 16:51:00
"Masa Jabatan Firli dkk Diperpanjang, Pemerintah Tak Bentuk Pansel Capim KPK",2023-06-09 16:43:00
"2 Pengusaha Penyuap Hakim Agung Dituntut 8,5 dan 8 Tahun Penjara",2023-06-09 16:35:00
"Bertambah 3, Jemaah Haji Indonesia Wafat di Arab Saudi Capai 29 Orang",2023-06-09 16:13:00
"Pemerintah Sepakat Ikuti Putusan MK, Masa Jabatan Pimpinan KPK Jadi 5 Tahun",2023-06-09 15:59:00
"Jokowi Akan Terbitkan Keppres, Masa Jabatan Firli dkk Bakal Diperpanjang",2023-06-09 15:56:00
Andhi Pramono Pakai Rekening Mertua untuk Transaksi Keuangan,2023-06-09 15:41:00
"Sandiaga Ingin Tawarkan PKS Ikut Keberlanjutan Pembangunan, Bukan Perubahan",2023-06-09 15:41:00
"Demokrat Dinilai Tak Sabaran, Mengada-ada soal Elektabilitas Anies Turun sebab Belum Ada Cawapres",2023-06-09 15:35:00
"Kaesang Pakai Kaos PSI, Puan Maharani: Mau Masuk PDI-P Enggak?",2023-06-09 15:29:00
"Berkaca dari Sidang Haris-Fatia, KY Ingatkan Pentingnya Akses Peradilan",2023-06-09 15:29:00
Sandiaga Rayu PKS Gabung Poros Percepatan Pembangunan,2023-06-09 15:04:00
Penjelasan Dispenad soal Eks Terpidana Pembunuhan Jabat Kapendam Tanjungpura,2023-06-09 15:02:00
Hary Tanoe Ungkap 3 Alasan yang Bikin Perindo Dukung Ganjar,2023-06-09 14:45:00
Gus Halim Pastikan Dana Desa Bisa Digunakan untuk Pengembangan Teknologi Tepat Guna,2023-06-09 14:29:00
Amnesty Internasional Sebut PN Jakarta Timur Beri Perlakuan Khusus terhadap Luhut dalam Sidang Fatia-Haris,2023-06-09 14:28:00
"Jalani Masa Ospek di PPP, Sandiaga: Sebentar Lagi Mudah-mudahan Enggak Jomblo Lagi",2023-06-09 14:24:00
"Pemenang GTTGN Ke-XXIII Diumumkan, Berikut Daftar Lengkapnya",2023-06-09 14:21:00
"Setelah Perindo, Puan Ungkap Ada Partai Lain yang Bakal Ikut Dukung Ganjar",2023-06-09 14:06:00
"Kerja Sama Politik dengan Perindo, Megawati Ingatkan Pemilu Itu Pileg, Pilkada, dan Pilpres",2023-06-09 14:03:00
Sandiaga Uno Tak Mau Dianggap Jadi Pihak yang Dekati PKS untuk Jegal Pencapresan Anies,2023-06-09 13:53:00
KY Minta Hakim Menahan Diri dari Perkataan yang Seksis dan Misoginis,2023-06-09 13:40:00
Ade Armando Mengaku Sukarela Bela Jokowi di Media Sosial,2023-06-09 13:27:00
"KY Pantau Sidang Haris Azhar-Fatia, Catat Semua Perilaku Hakim",2023-06-09 13:22:00
"Data KPU, PSI dan PDI-P Paling Miskin Bacaleg Perempuan, Ummat Terbanyak",2023-06-09 13:16:00
KPK Akan Kembangkan Dugaan Gratifikasi Andhi Pramono ke TPPU,2023-06-09 13:15:00
"Ketum PBNU Anggap ""Cawe-cawe"" Jokowi sebagai Tanggung Jawab Jaga Stabilitas",2023-06-09 13:11:00
"Gibran Belum Cukup Umur Maju pada Pilpres, Apa Saja Syarat Jadi Capres-Cawapres?",2023-06-09 13:09:00
Demokrat Dinilai Mulai Khawatir Arah Angin Cawapres Anies Lebih Berpihak ke Khofifah,2023-06-09 13:09:00
Ganjar: Insya Allah Kita Menangkan Pilpres 2024 Satu Putaran,2023-06-09 13:07:00
Gus Yahya Singgung Pilpres Bukanlah Persaingan yang Mesti Dibela Mati-matian,2023-06-09 13:07:00
Polri Bakal Siapkan Psikolog di Tingkat Polres hingga Adakan Kurikulum Terkait Psikologi,2023-06-09 12:45:00
"Jemaah Haji Dapat Asuransi Jiwa dan Kecelakaan, Ini Ketentuannya",2023-06-09 12:41:00
"Bosan Ditanya Siapa Bakal Cawapres Ganjar, Megawati: Untung Saya Ketum PDI-P, Bisa Putuskan Sendiri",2023-06-09 12:38:00
"Sempat Temui Prabowo, Kenapa Hary Tanoe Akhirnya Pilih Dukung Ganjar Capres?",2023-06-09 12:30:00
"Masuk sebagai Kandidat Cawapres Ganjar, Mahfud MD: Biasa Saja",2023-06-09 12:23:00
"Bertemu Jokowi di Istana, Ketum PBNU Sebut Tak Bicarakan Politik",2023-06-09 12:21:00
Kontras Kecam Semua Bentuk Penghalangan dalam Sidang Haris-Fatia,2023-06-09 12:14:00
Ganjar Bicara Mimpi Bung Karno Setelah Terima Dukungan Perindo,2023-06-09 12:10:00
"PBNU Tak Akan Dukung Capres Tertentu, Gus Yahya: Wong NU Bukan Parpol",2023-06-09 12:02:00
"Mahfud Bakal Bertemu Jokowi Siang Ini, Serahkan Kajian soal Masa Jabatan Pimpinan KPK",2023-06-09 11:57:00
Ketua MA Lantik Tiga Hakim Agung,2023-06-09 11:49:00
Demokrat Berpeluang Merapat ke Koalisi Gerindra jika AHY Tak Dipilih Anies Jadi Cawapres,2023-06-09 11:48:00
"Gelar Latihan Pasukan Khusus 3 Matra, Dankoopssus Nyatakan TNI Siap Atasi Terorisme",2023-06-09 11:39:00
Perindo Resmi Dukung Ganjar Pranowo sebagai Bakal Capres 2024,2023-06-09 11:35:00
"Sosialisasikan Program THK, Dompet Dhuafa Ajak Influencer hingga Rekan Media Jelajah Sentra Ternak Cianjur",2023-06-09 11:29:00
Kontras Kritik JPU dalam Sidang Kasus Haris Azhar dan Fatia,2023-06-09 11:21:00
KPK Sita Dokumen dari Staf Sekretaris MA,2023-06-09 11:13:00
"Gelar Skrining Kesehatan Bagi 342 Lansia, Dompet Dhuafa: Kami Tidak Mau Lansia Habiskan Anggaran BPJS",2023-06-09 10:56:00
Eks Jaksa KPK Dody Silalahi Diduga Bertemu Sekretaris MA Pasca-OTT Suap Hakim Agung,2023-06-09 10:46:00
"Jika Anies Tak Pilih AHY Jadi Cawapres, Demokrat Diprediksi Hengkang dari Koalisi Perubahan",2023-06-09 10:39:00
Olly Duga Isu Kontrak Politik Mega-Ganjar di Batu Tulis untuk Gerus Elektabilitas,2023-06-09 10:36:00
Kemenag Gelar Sidang Isbat Penetapan Idul Adha pada 18 Juni 2023,2023-06-09 10:18:00
Hary Tanoe dan Rombongan Partai Perindo Datangi Markas PDI-P Jajaki Kerja Sama Politik,2023-06-09 09:59:00
Cerita Ade Armando Takut Blusukan Setelah Jadi Korban Pengeroyokan...,2023-06-09 09:54:00
Junimart Girsang Minta Menteri PAN-RB Sampaikan Seluruh Data Tenaga Honorer yang Terdaftar,2023-06-09 09:49:00
"Saat Mahfud Sebut Satgas TPPU Tak Hilang dan Terus Bekerja, bahkan Makin Seru...",2023-06-09 09:40:00
PKS Klaim Tak Pernah Ngotot soal Cawapres Anies Harus dari Kadernya,2023-06-09 09:02:00
Ade Armando: PSI Ini seperti LSM yang Berubah Jadi Partai Politik,2023-06-09 08:43:00
Kejagung Periksa Stafsus Johnny G Plate di Kasus Korupsi BTS 4G Bakti Kominfo,2023-06-09 08:27:00
"Demokrat Dinilai Ambigu, Malu-malu Promosikan Anies, tapi Terus “Jual” AHY",2023-06-09 08:24:00
"Keakraban Jokowi dan Anwar Ibrahim, Saling Sebut Sahabat dan Blusukan Bareng",2023-06-09 08:16:00
Kala PKB Akan Evaluasi Koalisi dan Gerindra yang Menganggap Hal Itu Bukan Ancaman...,2023-06-09 07:49:00
"Candaan ""Koalisi Permanen"" Sejumlah Menteri di Malaysia...",2023-06-09 07:39:00
Langkah Pemerintah di Tengah Banyaknya Kasus TPPO,2023-06-09 06:59:00
Dinamika Pilpres dan Kontestasi Nir-Gagasan,2023-06-09 06:32:00
Serba-serbi Rakernas PDI-P: Kompaknya Mega-Jokowi dan Masuknya AHY di Bursa Cawapres Ganjar,2023-06-09 06:08:00
"18 Laporan Transaksi Mencurigakan Jadi Prioritas Satgas TPPU, Nilainya Rp 281,6 T",2023-06-09 05:42:00
"Nasdem dan Demokrat Memanas, Saling Balas soal Kapan Cawapres Anies Diumumkan",2023-06-09 05:30:00
BP2MI: Perlu Pemahaman Hukum yang Sama Berantasan Perdagangan Orang di ASEAN,2023-06-09 05:29:00
"Mahfud Ingatkan Pejabat, Pengacara agar Tak Halangi Pengungkapan Pencucian Uang",2023-06-09 05:21:00
"2 Jenazah Pekerja Migran Dipulangkan Setiap Hari, Wapres: Kita Cegah PMI Ilegal",2023-06-09 05:10:00
[POPULER NASIONAL] Kebuntuan Anies Baswedan | Blunder Prabowo Usulkan Proposal Damai Rusia-Ukraina,2023-06-09 05:00:00
Tanggal 11 Juni Memperingati Hari Apa?,2023-06-09 00:00:00
"BERITA FOTO: Megawati Ingin Ganjar Ditampilkan Otentik, Sosok Dekat dengan Rakyat",2023-06-08 23:53:00
"BERITA FOTO: Puan Bacakan Hasil Rakernas PDI-P, Menangkan Ganjar Sebagai Presiden di 2024",2023-06-08 23:38:00
BERITA FOTO: Puan Bocorkan Strategi Kampanye PDI-P di Pemilu 2024,2023-06-08 23:16:00
RUU Kesehatan Dikhawatirkan Tak Dapat Perhatian Penuh karena Kesibukan Pemilu 2024,2023-06-08 22:45:00
Penyidik Polri Bantah Terima Suap Atas Perkara yang Dikondisikan AKBP Bambang Kayun,2023-06-08 22:36:00
RUU Kesehatan Diharapkan Atur Pelayanan Bagi Perempuan dan Anak Korban Kekerasan,2023-06-08 22:28:00
"RUU Kesehatan Dinilai Perlu Menerapkan Perspektif Keadilan Gender, Ini Alasannya",2023-06-08 21:57:00
Megawati Minta Kader PDI-P Citrakan Ganjar Menyatu dengan Rakyat,2023-06-08 20:54:00
Wapres Enggan Komentari Penolakan Proposal Prabowo Soal Perdamaian Rusia-Ukraina,2023-06-08 20:54:00
"Respons Kepala Bappenas, Wapres Yakin Prevalensi Stunting Turun 2024",2023-06-08 20:42:00
"Calon Investor IKN Dijanjikan ""Tax Holiday"" Lebihi Rata-rata Demi Tarik Investasi",2023-06-08 20:31:00
"Peredaran Oli Palsu di Jatim Terungkap, Omzet Pelaku Rp 20 M Per Bulan",2023-06-08 20:23:00
"PKS Anggap Wajar Ada Partai yang Ngotot Kadernya Harus Jadi Cawapres Anies, tapi...",2023-06-08 20:21:00
Megawati: yang Tidak Mengakui Pancasila Jangan Hidup di Indonesia,2023-06-08 20:14:00
Satgas TPPU: Dugaan TPPU Emas Batangan Ilegal Rp 189 T Masih Penyelidikan,2023-06-08 20:11:00
2 Penyakit yang Sering Menyerang Jemaah Haji Lansia di Arab Saudi,2023-06-08 20:09:00
Papan Informasi Digital Hadir untuk Dukung Transparansi Kinerja DPD RI,2023-06-08 20:05:00
PPIH Minta Saudia Airlines Tak Lagi Ubah Jadwal Terbang dan Kapasitas Pesawat Haji,2023-06-08 19:57:00
Megawati Ingin Pemerintah Maksimalkan Pengelolaan SDA Kelautan,2023-06-08 19:42:00
"Disebut Dirayu Pejabat Negara untuk Gagalkan Anies Maju Capres, PKS Angkat Bicara",2023-06-08 19:22:00
"Mahfud: Laporan Satgas TPPU Hasilkan Tersangka, Nilai Dugaan Pencucian Uang Capai Rp 25 T",2023-06-08 19:14:00
"BERITA FOTO: Salam Metal, Megawati Tutup Rakernas Ketiga PDI Perjuangan",2023-06-08 19:13:00
BERITA FOTO: Momen Megawati Menangis Saat Mengenang Taufiq Kiemas,2023-06-08 19:01:00
"Dengan Salam Metal, Megawati Resmi Tutup Rakernas Ketiga PDI-P",2023-06-08 19:00:00
"Kepada Kader PDI-P, Megawati: ""Ndak"" Ada Rakyat, ""Ndak"" Ada Kita!",2023-06-08 18:57:00
"Megawati Ingatkan Kader PDI-P Turun ke Bawah, Jika Ingin Menang Pemilu 2024",2023-06-08 18:49:00
Megawati Minta Jumlah Pulau Indonesia Diteliti Ulang,2023-06-08 18:45:00
"Jokowi-Anwar Ibrahim Kunjungi Pasar, Pedagang Doakan Indonesia-Malaysia Makin Rukun",2023-06-08 18:29:00
"Rakernas PDI-P Sepakati Visi-misi Ganjar dan Wakilnya untuk Pilpres 2024, Ini Isinya",2023-06-08 18:26:00
"Update 8 Juni: Kasus Covid-19 Bertambah 254 dalam Sehari, Totalnya Jadi 6.809.631",2023-06-08 18:19:00
PDI-P Bocorkan Strategi Kampanye Pemilu 2024,2023-06-08 18:19:00
"GASPOL! Hari Ini: Banting Setir Ade Armando, dari Dosen Terjun ke Dunia Politik",2023-06-08 18:17:00
"Anggaran Renovasi Toilet DPD RI Rp 4,8 Miliar Dikritik, Begini Kondisi dan Penjelasannya",2023-06-08 18:12:00
"Permintaan Gas Besar, PGN Prediksi Volume dan Omzet Penjualan di KIT Batang Meningkat",2023-06-08 18:05:00
Megawati Perintahkan Bacaleg PDI-P Sosialisasikan Ganjar hingga ke Pelosok Negeri,2023-06-08 17:54:00
Megawati Tahan Air Mata Saat Kenang Haul 10 Tahun Meninggalnya Taufiq Kiemas Hari Ini,2023-06-08 17:53:00
"Bacakan Hasil Rakernas PDI-P, Puan Maharani: Menangkan Ganjar Pranowo di Tahun 2024!",2023-06-08 17:49:00
"Saut Situmorang Surati DPR soal Kasus Korupsi Kemenkominfo, Sufmi Dasco Beri Sambutan Baik",2023-06-08 17:44:00
Kemenkes Targetkan Seluruh Wilayah Punya Kawasan Tanpa Rokok Tahun Ini,2023-06-08 17:38:00
"Hasil Rakernas, PDI-P Komitmen Lanjutkan Warisan Jokowi, Tak Hanya IKN",2023-06-08 17:37:00
"Kasus Penipupan ""Jastip"" Tiket Coldplay, Bareskrim Dalami Mekanisme hingga Pengawasan",2023-06-08 17:36:00
"Megawati Minta Kader PDI-P Dekati Rakyat dengan Gerakan ""Dari Pintu ke Pintu""",2023-06-08 17:35:00
Megawati Ingin Ganjar Ditampilkan sebagai Figur Dekat dengan Rakyat,2023-06-08 17:33:00
Saat Jokowi Blusukan Bareng Anwar Ibrahim di Pasar Chow Kit Malaysia,2023-06-08 17:24:00
"Hasil Rakernas III, PDI-P Dorong Masa Jabatan Kades Diperpanjang Jadi 9 Tahun",2023-06-08 17:10:00
